Index,Date,Date_parsed,Year,U.S. Airline Traffic - Total - Seasonally Adjusted,U.S. Airline Traffic - International - Seasonally Adjusted,U.S. Airline Traffic - Domestic - Seasonally Adjusted,Transit Ridership - Other Transit Modes - Adjusted,Transit Ridership - Fixed Route Bus - Adjusted,Transit Ridership - Urban Rail - Adjusted,Freight Rail Intermodal Units,Freight Rail Carloads,Highway Vehicle Miles Traveled - All Systems,Highway Vehicle Miles Traveled - Total Rural,Highway Vehicle Miles Traveled - Other Rural,Highway Vehicle Miles Traveled - Rural Other Arterial,Highway Vehicle Miles Traveled - Rural Interstate,Unemployed - Seasonally Adjusted,Passenger Rail Passengers,Passenger Rail Passenger Miles,Passenger Rail Total Train Miles,Passenger Rail Employee Hours Worked,Passenger Rail Yard Switching Miles,Passenger Rail Total Reports,U.S. Waterway Tonnage,Transportation Services Index - Freight,Transportation Services Index - Passenger,Transportation Services Index - Combined,U.S.-Canada Incoming Truck Crossings,U.S.-Mexico Incoming Truck Crossings,U.S. marketing air carriers on-time performance (percent),U.S. Air Carrier Cargo (millions of revenue ton-miles) - International,Truck tonnage index,U.S. Air Carrier Cargo (millions of revenue ton-miles) - Domestic,U.S. Airline Traffic - Total - Non Seasonally Adjusted,U.S. Airline Traffic - International - Non Seasonally Adjusted,U.S. Airline Traffic - Domestic - Non Seasonally Adjusted,Transborder - Total North American Freight,Transborder - U.S. - Mexico Freight,Transborder - U.S. - Canada Freight
336,01/01/1975 12:00:00 AM,1975-01-01,1975,,,,,,,,,,,,,,,0.0,2624696.0,4134425.0,1501878.0,0.0,2.0,,,,,,,,,,,,,,,,
337,02/01/1975 12:00:00 AM,1975-02-01,1975,,,,,,,,,,,,,,,0.0,2275826.0,3600736.0,1371524.0,0.0,2.0,,,,,,,,,,,,,,,,
338,03/01/1975 12:00:00 AM,1975-03-01,1975,,,,,,,,,,,,,,,0.0,2520943.0,4067192.0,1516787.0,0.0,2.0,,,,,,,,,,,,,,,,
339,04/01/1975 12:00:00 AM,1975-04-01,1975,,,,,,,,,,,,,,,0.0,2478477.0,4000157.0,1583115.0,0.0,2.0,,,,,,,,,,,,,,,,
340,05/01/1975 12:00:00 AM,1975-05-01,1975,,,,,,,,,,,,,,,0.0,2561119.0,4050197.0,1544540.0,0.0,2.0,,,,,,,,,,,,,,,,
341,06/01/1975 12:00:00 AM,1975-06-01,1975,,,,,,,,,,,,,,,0.0,2549572.0,4013103.0,1639952.0,0.0,2.0,,,,,,,,,,,,,,,,
342,07/01/1975 12:00:00 AM,1975-07-01,1975,,,,,,,,,,,,,,,0.0,2641537.0,4050570.0,1760248.0,0.0,2.0,,,,,,,,,,,,,,,,
343,08/01/1975 12:00:00 AM,1975-08-01,1975,,,,,,,,,,,,,,,0.0,2653549.0,4075438.0,1678639.0,0.0,2.0,,,,,,,,,,,,,,,,
344,09/01/1975 12:00:00 AM,1975-09-01,1975,,,,,,,,,,,,,,,0.0,2463992.0,4012156.0,1621803.0,0.0,2.0,,,,,,,,,,,,,,,,
345,10/01/1975 12:00:00 AM,1975-10-01,1975,,,,,,,,,,,,,,,0.0,2487430.0,3819751.0,1506077.0,0.0,2.0,,,,,,,,,,,,,,,,
346,11/01/1975 12:00:00 AM,1975-11-01,1975,,,,,,,,,,,,,,,0.0,2476125.0,3650153.0,1497704.0,0.0,2.0,,,,,,,,,,,,,,,,
347,12/01/1975 12:00:00 AM,1975-12-01,1975,,,,,,,,,,,,,,,0.0,2677458.0,4840304.0,1793002.0,0.0,2.0,,,,,,,,,,,,,,,,
348,01/01/1976 12:00:00 AM,1976-01-01,1976,,,,,,,,,,,,,,,996828.0,202351881.0,2273275.0,3548703.0,0.0,2.0,,,,,,,,,,,,,,,,
349,02/01/1976 12:00:00 AM,1976-02-01,1976,,,,,,,,,,,,,,,887277.0,164519889.0,2251815.0,2916547.0,0.0,2.0,,,,,,,,,,,,,,,,
350,03/01/1976 12:00:00 AM,1976-03-01,1976,,,,,,,,,,,,,,,1056631.0,201489751.0,2251815.0,3192050.0,0.0,2.0,,,,,,,,,,,,,,,,
351,04/01/1976 12:00:00 AM,1976-04-01,1976,,,,,,,,,,,,,,,1152911.0,238652605.0,2251815.0,3190463.0,0.0,2.0,,,,,,,,,,,,,,,,
352,05/01/1976 12:00:00 AM,1976-05-01,1976,,,,,,,,,,,,,,,1149155.0,216748268.0,2216552.0,3193174.0,0.0,2.0,,,,,,,,,,,,,,,,
353,06/01/1976 12:00:00 AM,1976-06-01,1976,,,,,,,,,,,,,,,1160478.0,268086916.0,2216552.0,2107084.0,0.0,2.0,,,,,,,,,,,,,,,,
354,07/01/1976 12:00:00 AM,1976-07-01,1976,,,,,,,,,,,,,,,1222553.0,326045324.0,2216552.0,2066915.0,0.0,2.0,,,,,,,,,,,,,,,,
355,08/01/1976 12:00:00 AM,1976-08-01,1976,,,,,,,,,,,,,,,1266288.0,330319599.0,2216552.0,2034382.0,0.0,2.0,,,,,,,,,,,,,,,,
356,09/01/1976 12:00:00 AM,1976-09-01,1976,,,,,,,,,,,,,,,1008553.0,197915221.0,2393205.0,2081699.0,0.0,2.0,,,,,,,,,,,,,,,,
357,10/01/1976 12:00:00 AM,1976-10-01,1976,,,,,,,,,,,,,,,1012449.0,183965385.0,2479727.0,1908199.0,0.0,2.0,,,,,,,,,,,,,,,,
358,11/01/1976 12:00:00 AM,1976-11-01,1976,,,,,,,,,,,,,,,1072691.0,197218172.0,2479727.0,1606059.0,0.0,2.0,,,,,,,,,,,,,,,,
359,12/01/1976 12:00:00 AM,1976-12-01,1976,,,,,,,,,,,,,,,1105820.0,239325713.0,2479727.0,1782476.0,0.0,2.0,,,,,,,,,,,,,,,,
360,01/01/1977 12:00:00 AM,1977-01-01,1977,,,,,,,,,,,,,,,1437596.0,291825616.0,2307894.0,3589989.0,0.0,2.0,,,,,,,,,,,,,,,,
361,02/01/1977 12:00:00 AM,1977-02-01,1977,,,,,,,,,,,,,,,1279606.0,237265489.0,2286107.0,2950478.0,0.0,2.0,,,,,,,,,,,,,,,,
362,03/01/1977 12:00:00 AM,1977-03-01,1977,,,,,,,,,,,,,,,1523842.0,290582278.0,2286107.0,3229187.0,0.0,2.0,,,,,,,,,,,,,,,,
363,04/01/1977 12:00:00 AM,1977-04-01,1977,,,,,,,,,,,,,,,1662694.0,344177395.0,2286107.0,3227581.0,0.0,2.0,,,,,,,,,,,,,,,,
364,05/01/1977 12:00:00 AM,1977-05-01,1977,,,,,,,,,,,,,,,1657277.0,312587639.0,2250307.0,3230324.0,0.0,2.0,,,,,,,,,,,,,,,,
365,06/01/1977 12:00:00 AM,1977-06-01,1977,,,,,,,,,,,,,,,1673607.0,386626648.0,2250307.0,2131598.0,0.0,2.0,,,,,,,,,,,,,,,,
366,07/01/1977 12:00:00 AM,1977-07-01,1977,,,,,,,,,,,,,,,1763130.0,470212468.0,2250307.0,2090962.0,0.0,2.0,,,,,,,,,,,,,,,,
367,08/01/1977 12:00:00 AM,1977-08-01,1977,,,,,,,,,,,,,,,1826204.0,476376695.0,2250307.0,2058050.0,0.0,2.0,,,,,,,,,,,,,,,,
368,09/01/1977 12:00:00 AM,1977-09-01,1977,,,,,,,,,,,,,,,1454505.0,285427203.0,2429650.0,2105918.0,0.0,2.0,,,,,,,,,,,,,,,,
369,10/01/1977 12:00:00 AM,1977-10-01,1977,,,,,,,,,,,,,,,1460123.0,265309182.0,2517490.0,1930399.0,0.0,2.0,,,,,,,,,,,,,,,,
370,11/01/1977 12:00:00 AM,1977-11-01,1977,,,,,,,,,,,,,,,1547003.0,284421939.0,2517490.0,1624745.0,0.0,2.0,,,,,,,,,,,,,,,,
371,12/01/1977 12:00:00 AM,1977-12-01,1977,,,,,,,,,,,,,,,1594782.0,345148131.0,2517490.0,1803214.0,0.0,2.0,,,,,,,,,,,,,,,,
372,01/01/1978 12:00:00 AM,1978-01-01,1978,,,,,,,,,,,,,,,1391774.0,287236602.0,2709777.0,3474610.0,50768.0,2.0,,,,,,,,,,,,,,,,
373,02/01/1978 12:00:00 AM,1978-02-01,1978,,,,,,,,,,,,,,,1356145.0,258838712.0,2709777.0,3258980.0,50768.0,2.0,,,,,,,,,,,,,,,,
374,03/01/1978 12:00:00 AM,1978-03-01,1978,,,,,,,,,,,,,,,1707239.0,355226561.0,2709777.0,3345861.0,50768.0,2.0,,,,,,,,,,,,,,,,
375,04/01/1978 12:00:00 AM,1978-04-01,1978,,,,,,,,,,,,,,,1662485.0,319749376.0,2689068.0,3389751.0,49798.0,2.0,,,,,,,,,,,,,,,,
376,05/01/1978 12:00:00 AM,1978-05-01,1978,,,,,,,,,,,,,,,1666871.0,319754286.0,2665799.0,3494393.0,49789.0,2.0,,,,,,,,,,,,,,,,
377,06/01/1978 12:00:00 AM,1978-06-01,1978,,,,,,,,,,,,,,,1679257.0,330444939.0,2665799.0,3618324.0,49789.0,2.0,,,,,,,,,,,,,,,,
378,07/01/1978 12:00:00 AM,1978-07-01,1978,,,,,,,,,,,,,,,1600757.0,368272257.0,2787962.0,3273926.0,49789.0,2.0,,,,,,,,,,,,,,,,
379,08/01/1978 12:00:00 AM,1978-08-01,1978,,,,,,,,,,,,,,,1753974.0,443510955.0,2804059.0,3286011.0,49798.0,2.0,,,,,,,,,,,,,,,,
380,09/01/1978 12:00:00 AM,1978-09-01,1978,,,,,,,,,,,,,,,1766872.0,462215107.0,2804059.0,3540385.0,49798.0,2.0,,,,,,,,,,,,,,,,
381,10/01/1978 12:00:00 AM,1978-10-01,1978,,,,,,,,,,,,,,,1427120.0,281746816.0,2804059.0,3410058.0,49798.0,2.0,,,,,,,,,,,,,,,,
382,11/01/1978 12:00:00 AM,1978-11-01,1978,,,,,,,,,,,,,,,1452261.0,298975774.0,2723805.0,3252447.0,49600.0,2.0,,,,,,,,,,,,,,,,
383,12/01/1978 12:00:00 AM,1978-12-01,1978,,,,,,,,,,,,,,,1677584.0,341406277.0,2723805.0,3278135.0,49600.0,2.0,,,,,,,,,,,,,,,,
384,01/01/1979 12:00:00 AM,1979-01-01,1979,,,,,,,,,,,,,,,1577481.0,332438930.0,2665646.0,3183603.0,47234.0,2.0,,,,,,,,,,,,,,,,
385,02/01/1979 12:00:00 AM,1979-02-01,1979,,,,,,,,,,,,,,,1420085.0,292459667.0,2715779.0,2919036.0,82887.0,2.0,,,,,,,,,,,,,,,,
386,03/01/1979 12:00:00 AM,1979-03-01,1979,,,,,,,,,,,,,,,1704073.0,358911279.0,2695503.0,3099983.0,58706.0,2.0,,,,,,,,,,,,,,,,
387,04/01/1979 12:00:00 AM,1979-04-01,1979,,,,,,,,,,,,,,,1854583.0,429690320.0,2723715.0,3101774.0,56834.0,2.0,,,,,,,,,,,,,,,,
388,05/01/1979 12:00:00 AM,1979-05-01,1979,,,,,,,,,,,,,,,1938714.0,423567784.0,2731114.0,3548594.0,58130.0,2.0,,,,,,,,,,,,,,,,
389,06/01/1979 12:00:00 AM,1979-06-01,1979,,,,,,,,,,,,,,,1875203.0,431688325.0,2850754.0,3458438.0,59676.0,2.0,,,,,,,,,,,,,,,,
390,07/01/1979 12:00:00 AM,1979-07-01,1979,,,,,,,,,,,,,,,2189632.0,579442355.0,2882810.0,3511732.0,59858.0,2.0,,,,,,,,,,,,,,,,
391,08/01/1979 12:00:00 AM,1979-08-01,1979,,,,,,,,,,,,,,,2208284.0,576096475.0,2888889.0,3354132.0,60237.0,2.0,,,,,,,,,,,,,,,,
392,09/01/1979 12:00:00 AM,1979-09-01,1979,,,,,,,,,,,,,,,1641040.0,356856839.0,2839172.0,3318416.0,57051.0,2.0,,,,,,,,,,,,,,,,
393,10/01/1979 12:00:00 AM,1979-10-01,1979,,,,,,,,,,,,,,,1620595.0,304052657.0,2849533.0,3193102.0,55681.0,2.0,,,,,,,,,,,,,,,,
394,11/01/1979 12:00:00 AM,1979-11-01,1979,,,,,,,,,,,,,,,1695042.0,319775002.0,2840769.0,3813529.0,58209.0,2.0,,,,,,,,,,,,,,,,
395,12/01/1979 12:00:00 AM,1979-12-01,1979,,,,,,,,,,,,,,,1694139.0,391251407.0,2667611.0,3197776.0,55129.0,2.0,,,,,,,,,,,,,,,,
396,01/01/1980 12:00:00 AM,1980-01-01,1980,,,,,,,,,,,,,,,1578290.0,323882518.0,2456398.0,3293730.0,47097.0,2.0,,,,,,,,,,,,,,,,
397,02/01/1980 12:00:00 AM,1980-02-01,1980,,,,,,,,,,,,,,,1525752.0,300938429.0,2450916.0,3501179.0,46577.0,2.0,,,,,,,,,,,,,,,,
398,03/01/1980 12:00:00 AM,1980-03-01,1980,,,,,,,,,,,,,,,1760796.0,354669362.0,2462566.0,3273383.0,47164.0,2.0,,,,,,,,,,,,,,,,
399,04/01/1980 12:00:00 AM,1980-04-01,1980,,,,,,,,,,,,,,,1773639.0,375635173.0,2583261.0,3402143.0,46122.0,2.0,,,,,,,,,,,,,,,,
400,05/01/1980 12:00:00 AM,1980-05-01,1980,,,,,,,,,,,,,,,1848318.0,364492106.0,2614674.0,3566376.0,49102.0,2.0,,,,,,,,,,,,,,,,
401,06/01/1980 12:00:00 AM,1980-06-01,1980,,,,,,,,,,,,,,,1941523.0,448949828.0,2614470.0,3581070.0,46523.0,2.0,,,,,,,,,,,,,,,,
402,07/01/1980 12:00:00 AM,1980-07-01,1980,,,,,,,,,,,,,,,2062274.0,517803638.0,2762993.0,3651680.0,54563.0,2.0,,,,,,,,,,,,,,,,
403,08/01/1980 12:00:00 AM,1980-08-01,1980,,,,,,,,,,,,,,,2221053.0,540785182.0,2773160.0,3265583.0,52667.0,2.0,,,,,,,,,,,,,,,,
404,09/01/1980 12:00:00 AM,1980-09-01,1980,,,,,,,,,,,,,,,1632467.0,341722593.0,2755955.0,3101045.0,52327.0,2.0,,,,,,,,,,,,,,,,
405,10/01/1980 12:00:00 AM,1980-10-01,1980,,,,,,,,,,,,,,,1707361.0,342363610.0,2732938.0,3497160.0,50909.0,2.0,,,,,,,,,,,,,,,,
406,11/01/1980 12:00:00 AM,1980-11-01,1980,,,,,,,,,,,,,,,1656067.0,319669631.0,2709296.0,3319898.0,50032.0,2.0,,,,,,,,,,,,,,,,
407,12/01/1980 12:00:00 AM,1980-12-01,1980,,,,,,,,,,,,,,,1730875.0,415505216.0,2698082.0,4578363.0,49171.0,2.0,,,,,,,,,,,,,,,,
408,01/01/1981 12:00:00 AM,1981-01-01,1981,,,,,,,,,,,,,,,1520915.0,343956618.0,2688839.0,3822383.0,51302.0,2.0,,,,,,,,,,,,,,,,
409,02/01/1981 12:00:00 AM,1981-02-01,1981,,,,,,,,,,,,,,,1425523.0,294135454.0,2680427.0,3797940.0,48716.0,2.0,,,,,,,,,,,,,,,,
410,03/01/1981 12:00:00 AM,1981-03-01,1981,,,,,,,,,,,,,,,1708445.0,373372418.0,2709225.0,4097161.0,48914.0,2.0,,,,,,,,,,,,,,,,
411,04/01/1981 12:00:00 AM,1981-04-01,1981,,,,,,,,,,,,,,,1861920.0,418617942.0,2723559.0,3657729.0,52649.0,2.0,,,,,,,,,,,,,,,,
412,05/01/1981 12:00:00 AM,1981-05-01,1981,,,,,,,,,,,,,,,1835570.0,380282446.0,2800356.0,3598082.0,43550.0,2.0,,,,,,,,,,,,,,,,
413,06/01/1981 12:00:00 AM,1981-06-01,1981,,,,,,,,,,,,,,,1872614.0,466750379.0,2828921.0,3680319.0,44434.0,2.0,,,,,,,,,,,,,,,,
414,07/01/1981 12:00:00 AM,1981-07-01,1981,,,,,,,,,,,,,,,1885958.0,468332285.0,2835717.0,3610388.0,46880.0,2.0,,,,,,,,,,,,,,,,
415,08/01/1981 12:00:00 AM,1981-08-01,1981,,,,,,,,,,,,,,,1945558.0,526685917.0,2806148.0,3357723.0,38467.0,2.0,,,,,,,,,,,,,,,,
416,09/01/1981 12:00:00 AM,1981-09-01,1981,,,,,,,,,,,,,,,1925194.0,525108456.0,2774995.0,3373042.0,41208.0,2.0,,,,,,,,,,,,,,,,
417,10/01/1981 12:00:00 AM,1981-10-01,1981,,,,,,,,,,,,,,,1885518.0,535087861.0,2739032.0,3204312.0,38045.0,2.0,,,,,,,,,,,,,,,,
418,11/01/1981 12:00:00 AM,1981-11-01,1981,,,,,,,,,,,,,,,1561930.0,354611461.0,2712986.0,3093771.0,38229.0,2.0,,,,,,,,,,,,,,,,
419,12/01/1981 12:00:00 AM,1981-12-01,1981,,,,,,,,,,,,,,,1561673.0,354596797.0,2768554.0,3141127.0,40733.0,2.0,,,,,,,,,,,,,,,,
420,01/01/1982 12:00:00 AM,1982-01-01,1982,,,,,,,,,,,,,,,1547623.0,291664176.0,2794754.0,3098257.0,39168.0,2.0,,,,,,,,,,,,,,,,
421,02/01/1982 12:00:00 AM,1982-02-01,1982,,,,,,,,,,,,,,,1541403.0,318837837.0,2745598.0,3292813.0,36674.0,2.0,,,,,,,,,,,,,,,,
422,03/01/1982 12:00:00 AM,1982-03-01,1982,,,,,,,,,,,,,,,1413187.0,276534903.0,2786365.0,3371540.0,36763.0,2.0,,,,,,,,,,,,,,,,
423,04/01/1982 12:00:00 AM,1982-04-01,1982,,,,,,,,,,,,,,,1599424.0,334977975.0,2808115.0,3225333.0,38920.0,2.0,,,,,,,,,,,,,,,,
424,05/01/1982 12:00:00 AM,1982-05-01,1982,,,,,,,,,,,,,,,1573111.0,298468514.0,2636437.0,3239839.0,41880.0,2.0,,,,,,,,,,,,,,,,
425,06/01/1982 12:00:00 AM,1982-06-01,1982,,,,,,,,,,,,,,,1648035.0,373090871.0,2652603.0,3353045.0,41591.0,2.0,,,,,,,,,,,,,,,,
426,07/01/1982 12:00:00 AM,1982-07-01,1982,,,,,,,,,,,,,,,1787798.0,459324724.0,2669187.0,3220500.0,42246.0,2.0,,,,,,,,,,,,,,,,
427,08/01/1982 12:00:00 AM,1982-08-01,1982,,,,,,,,,,,,,,,1786232.0,460358208.0,2672709.0,3281079.0,39353.0,2.0,,,,,,,,,,,,,,,,
428,09/01/1982 12:00:00 AM,1982-09-01,1982,,,,,,,,,,,,,,,1379782.0,308384272.0,2691277.0,3111591.0,42595.0,2.0,,,,,,,,,,,,,,,,
429,10/01/1982 12:00:00 AM,1982-10-01,1982,,,,,,,,,,,,,,,1399247.0,282048323.0,2641126.0,3171928.0,39204.0,2.0,,,,,,,,,,,,,,,,
430,11/01/1982 12:00:00 AM,1982-11-01,1982,,,,,,,,,,,,,,,1441052.0,267079114.0,2592092.0,3049554.0,36811.0,2.0,,,,,,,,,,,,,,,,
431,12/01/1982 12:00:00 AM,1982-12-01,1982,,,,,,,,,,,,,,,1549025.0,344868233.0,2574038.0,3144559.0,36842.0,2.0,,,,,,,,,,,,,,,,
432,01/01/1983 12:00:00 AM,1983-01-01,1983,,,,,,,,,,,,,,,1341059.0,249387529.0,2587549.0,3247584.0,35706.0,2.0,,,,,,,,,,,,,,,,
433,02/01/1983 12:00:00 AM,1983-02-01,1983,,,,,,,,,,,,,,,1303557.0,247571244.0,2598558.0,3004099.0,35405.0,2.0,,,,,,,,,,,,,,,,
434,03/01/1983 12:00:00 AM,1983-03-01,1983,,,,,,,,,,,,,,,1844343.0,352307186.0,2590471.0,3507476.0,37649.0,2.0,,,,,,,,,,,,,,,,
435,04/01/1983 12:00:00 AM,1983-04-01,1983,,,,,,,,,,,,,,,1651721.0,367071178.0,2589149.0,3242007.0,35482.0,2.0,,,,,,,,,,,,,,,,
436,05/01/1983 12:00:00 AM,1983-05-01,1983,,,,,,,,,,,,,,,1775455.0,395670361.0,2682550.0,3367493.0,37350.0,2.0,,,,,,,,,,,,,,,,
437,06/01/1983 12:00:00 AM,1983-06-01,1983,,,,,,,,,,,,,,,1711937.0,378701934.0,2762508.0,3472530.0,39213.0,2.0,,,,,,,,,,,,,,,,
438,07/01/1983 12:00:00 AM,1983-07-01,1983,,,,,,,,,,,,,,,1797846.0,491145822.0,2758865.0,3313419.0,42440.0,2.0,,,,,,,,,,,,,,,,
439,08/01/1983 12:00:00 AM,1983-08-01,1983,,,,,,,,,,,,,,,1867284.0,502936360.0,2775819.0,3702029.0,41990.0,2.0,,,,,,,,,,,,,,,,
440,09/01/1983 12:00:00 AM,1983-09-01,1983,,,,,,,,,,,,,,,1492043.0,341851501.0,2762749.0,3537411.0,37890.0,2.0,,,,,,,,,,,,,,,,
441,10/01/1983 12:00:00 AM,1983-10-01,1983,,,,,,,,,,,,,,,1514220.0,304623060.0,2643982.0,3350252.0,37401.0,2.0,,,,,,,,,,,,,,,,
442,11/01/1983 12:00:00 AM,1983-11-01,1983,,,,,,,,,,,,,,,1685990.0,339730596.0,2611111.0,3413642.0,38054.0,2.0,,,,,,,,,,,,,,,,
443,12/01/1983 12:00:00 AM,1983-12-01,1983,,,,,,,,,,,,,,,1740703.0,398461946.0,2596377.0,3350633.0,35296.0,2.0,,,,,,,,,,,,,,,,
444,01/01/1984 12:00:00 AM,1984-01-01,1984,,,,,,,,,,,,,,,1467803.0,307681981.0,2564627.0,3457852.0,33929.0,2.0,,,,,,,,,,,,,,,,
445,02/01/1984 12:00:00 AM,1984-02-01,1984,,,,,,,,,,,,,,,1436811.0,291174544.0,2542197.0,3509266.0,35563.0,2.0,,,,,,,,,,,,,,,,
446,03/01/1984 12:00:00 AM,1984-03-01,1984,,,,,,,,,,,,,,,1844863.0,352312310.0,2551267.0,3742825.0,38488.0,2.0,,,,,,,,,,,,,,,,
447,04/01/1984 12:00:00 AM,1984-04-01,1984,,,,,,,,,,,,,,,1715714.0,363831315.0,2650053.0,3596604.0,36945.0,2.0,,,,,,,,,,,,,,,,
448,05/01/1984 12:00:00 AM,1984-05-01,1984,,,,,,,,,,,,,,,1790525.0,385418088.0,2670333.0,3830679.0,41264.0,2.0,,,,,,,,,,,,,,,,
449,06/01/1984 12:00:00 AM,1984-06-01,1984,,,,,,,,,,,,,,,1856406.0,486947879.0,2670526.0,3833360.0,38716.0,2.0,,,,,,,,,,,,,,,,
450,07/01/1984 12:00:00 AM,1984-07-01,1984,,,,,,,,,,,,,,,1835175.0,489114018.0,2696385.0,3966936.0,42055.0,2.0,,,,,,,,,,,,,,,,
451,08/01/1984 12:00:00 AM,1984-08-01,1984,,,,,,,,,,,,,,,1907818.0,489076562.0,2696351.0,3886219.0,37576.0,2.0,,,,,,,,,,,,,,,,
452,09/01/1984 12:00:00 AM,1984-09-01,1984,,,,,,,,,,,,,,,1519687.0,332632187.0,2665962.0,3625893.0,37649.0,2.0,,,,,,,,,,,,,,,,
453,10/01/1984 12:00:00 AM,1984-10-01,1984,,,,,,,,,,,,,,,1646059.0,322808898.0,2613480.0,3868378.0,35387.0,2.0,,,,,,,,,,,,,,,,
454,11/01/1984 12:00:00 AM,1984-11-01,1984,,,,,,,,,,,,,,,1695506.0,338072234.0,2562281.0,3586010.0,34839.0,2.0,,,,,,,,,,,,,,,,
455,12/01/1984 12:00:00 AM,1984-12-01,1984,,,,,,,,,,,,,,,1721071.0,397050861.0,2588197.0,3592605.0,34726.0,2.0,,,,,,,,,,,,,,,,
456,01/01/1985 12:00:00 AM,1985-01-01,1985,,,,,,,,,,,,,,,1545184.0,321076094.0,2649730.0,3458493.0,36323.0,2.0,,,,,,,,,,,,,,,,
457,02/01/1985 12:00:00 AM,1985-02-01,1985,,,,,,,,,,,,,,,1465605.0,293523705.0,2597076.0,3177217.0,36454.0,2.0,,,,,,,,,,,,,,,,
458,03/01/1985 12:00:00 AM,1985-03-01,1985,,,,,,,,,,,,,,,2425329.0,321126882.0,2667676.0,3276279.0,41659.0,2.0,,,,,,,,,,,,,,,,
459,04/01/1985 12:00:00 AM,1985-04-01,1985,,,,,,,,,,,,,,,1817154.0,399849791.0,2651121.0,3317863.0,37190.0,2.0,,,,,,,,,,,,,,,,
460,05/01/1985 12:00:00 AM,1985-05-01,1985,,,,,,,,,,,,,,,1892166.0,426612452.0,2704860.0,3500832.0,38225.0,2.0,,,,,,,,,,,,,,,,
461,06/01/1985 12:00:00 AM,1985-06-01,1985,,,,,,,,,,,,,,,1902643.0,509520086.0,2765995.0,3344976.0,43331.0,2.0,,,,,,,,,,,,,,,,
462,07/01/1985 12:00:00 AM,1985-07-01,1985,,,,,,,,,,,,,,,1973724.0,535791329.0,2759129.0,3396984.0,47946.0,2.0,,,,,,,,,,,,,,,,
463,08/01/1985 12:00:00 AM,1985-08-01,1985,,,,,,,,,,,,,,,2072542.0,563906126.0,2743590.0,3362645.0,39001.0,2.0,,,,,,,,,,,,,,,,
464,09/01/1985 12:00:00 AM,1985-09-01,1985,,,,,,,,,,,,,,,1535591.0,356816889.0,2673361.0,3254110.0,23495.0,2.0,,,,,,,,,,,,,,,,
465,10/01/1985 12:00:00 AM,1985-10-01,1985,,,,,,,,,,,,,,,1675177.0,365391089.0,2676010.0,3315971.0,42348.0,2.0,,,,,,,,,,,,,,,,
466,11/01/1985 12:00:00 AM,1985-11-01,1985,,,,,,,,,,,,,,,1701898.0,372434446.0,2627707.0,3198287.0,37805.0,2.0,,,,,,,,,,,,,,,,
467,12/01/1985 12:00:00 AM,1985-12-01,1985,,,,,,,,,,,,,,,854511.0,1974634.0,2669453.0,3211825.0,39367.0,2.0,,,,,,,,,,,,,,,,
468,01/01/1986 12:00:00 AM,1986-01-01,1986,,,,,,,,,,,,,,,1493719.0,349586084.0,2680692.0,3354444.0,39510.0,2.0,,,,,,,,,,,,,,,,
469,02/01/1986 12:00:00 AM,1986-02-01,1986,,,,,,,,,,,,,,,1412130.0,312596501.0,2640693.0,3110099.0,38294.0,2.0,,,,,,,,,,,,,,,,
470,03/01/1986 12:00:00 AM,1986-03-01,1986,,,,,,,,,,,,,,,1738517.0,411930640.0,2641264.0,3269425.0,37669.0,2.0,,,,,,,,,,,,,,,,
471,04/01/1986 12:00:00 AM,1986-04-01,1986,,,,,,,,,,,,,,,1659967.0,377826410.0,2661009.0,3265479.0,42092.0,2.0,,,,,,,,,,,,,,,,
472,05/01/1986 12:00:00 AM,1986-05-01,1986,,,,,,,,,,,,,,,1759297.0,404516445.0,2689122.0,3245102.0,37331.0,2.0,,,,,,,,,,,,,,,,
473,06/01/1986 12:00:00 AM,1986-06-01,1986,,,,,,,,,,,,,,,1838438.0,500624667.0,2692519.0,3246970.0,38952.0,2.0,,,,,,,,,,,,,,,,
474,07/01/1986 12:00:00 AM,1986-07-01,1986,,,,,,,,,,,,,,,1929123.0,534847559.0,2720757.0,3401328.0,41230.0,2.0,,,,,,,,,,,,,,,,
475,08/01/1986 12:00:00 AM,1986-08-01,1986,,,,,,,,,,,,,,,1981564.0,545916903.0,2711050.0,3656442.0,37174.0,2.0,,,,,,,,,,,,,,,,
476,09/01/1986 12:00:00 AM,1986-09-01,1986,,,,,,,,,,,,,,,1550647.0,376880443.0,2658921.0,3318209.0,36531.0,2.0,,,,,,,,,,,,,,,,
477,10/01/1986 12:00:00 AM,1986-10-01,1986,,,,,,,,,,,,,,,1681599.0,390813134.0,2574687.0,3312136.0,33059.0,2.0,,,,,,,,,,,,,,,,
478,11/01/1986 12:00:00 AM,1986-11-01,1986,,,,,,,,,,,,,,,1660519.0,371478152.0,2607625.0,3400056.0,35029.0,2.0,,,,,,,,,,,,,,,,
479,12/01/1986 12:00:00 AM,1986-12-01,1986,,,,,,,,,,,,,,,1724873.0,447767559.0,2605015.0,3506666.0,36802.0,2.0,,,,,,,,,,,,,,,,
480,01/01/1987 12:00:00 AM,1987-01-01,1987,,,,,,,,,,,,,,,1450628.0,358289350.0,2459546.0,3769935.0,32573.0,2.0,,,,,,,,,,,,,,,,
481,02/01/1987 12:00:00 AM,1987-02-01,1987,,,,,,,,,,,,,,,1372333.0,301085684.0,2451109.0,3755831.0,24981.0,2.0,,,,,,,,,,,,,,,,
482,03/01/1987 12:00:00 AM,1987-03-01,1987,,,,,,,,,,,,,,,2759081.0,388815258.0,2461279.0,3538017.0,33413.0,2.0,,,,,,,,,,,,,,,,
483,04/01/1987 12:00:00 AM,1987-04-01,1987,,,,,,,,,,,,,,,2770118.0,426085439.0,2469475.0,3773246.0,34841.0,2.0,,,,,,,,,,,,,,,,
484,05/01/1987 12:00:00 AM,1987-05-01,1987,,,,,,,,,,,,,,,2775109.0,458751988.0,2482239.0,3802843.0,35693.0,2.0,,,,,,,,,,,,,,,,
485,06/01/1987 12:00:00 AM,1987-06-01,1987,,,,,,,,,,,,,,,2945723.0,552030727.0,2504024.0,3770726.0,37907.0,2.0,,,,,,,,,,,,,,,,
486,07/01/1987 12:00:00 AM,1987-07-01,1987,,,,,,,,,,,,,,,3045135.0,617011317.0,2491466.0,3925557.0,38273.0,2.0,,,,,,,,,,,,,,,,
487,08/01/1987 12:00:00 AM,1987-08-01,1987,,,,,,,,,,,,,,,3440627.0,612281988.0,2492619.0,3921396.0,36545.0,2.0,,,,,,,,,,,,,,,,
488,09/01/1987 12:00:00 AM,1987-09-01,1987,,,,,,,,,,,,,,,2797714.0,444662254.0,2503398.0,3858954.0,38105.0,2.0,,,,,,,,,,,,,,,,
489,10/01/1987 12:00:00 AM,1987-10-01,1987,,,,,,,,,,,,,,,2906499.0,459915152.0,3676371.0,3863048.0,36623.0,2.0,,,,,,,,,,,,,,,,
490,11/01/1987 12:00:00 AM,1987-11-01,1987,,,,,,,,,,,,,,,2894114.0,449298073.0,3671530.0,3886013.0,34151.0,2.0,,,,,,,,,,,,,,,,
491,12/01/1987 12:00:00 AM,1987-12-01,1987,,,,,,,,,,,,,,,2937638.0,512975274.0,3674109.0,3900396.0,35573.0,2.0,,,,,,,,,,,,,,,,
492,01/01/1988 12:00:00 AM,1988-01-01,1988,,,,,,,,,,,,,,,2758022.0,438205167.0,2974007.0,3839743.0,253812.0,2.0,,,,,,,,,,,,,,,,
493,02/01/1988 12:00:00 AM,1988-02-01,1988,,,,,,,,,,,,,,,2775449.0,398804701.0,2959143.0,3806424.0,238823.0,2.0,,,,,,,,,,,,,,,,
494,03/01/1988 12:00:00 AM,1988-03-01,1988,,,,,,,,,,,,,,,3039536.0,477518429.0,2996982.0,3799798.0,254663.0,2.0,,,,,,,,,,,,,,,,
495,04/01/1988 12:00:00 AM,1988-04-01,1988,,,,,,,,,,,,,,,3007325.0,489350896.0,2978239.0,3957654.0,246527.0,2.0,,,,,,,,,,,,,,,,
496,05/01/1988 12:00:00 AM,1988-05-01,1988,,,,,,,,,,,,,,,3138900.0,504941385.0,3097446.0,3932968.0,255602.0,2.0,,,,,,,,,,,,,,,,
497,06/01/1988 12:00:00 AM,1988-06-01,1988,,,,,,,,,,,,,,,3160569.0,561852336.0,2991850.0,3772320.0,248326.0,2.0,,,,,,,,,,,,,,,,
498,07/01/1988 12:00:00 AM,1988-07-01,1988,,,,,,,,,,,,,,,3190245.0,626555031.0,2989658.0,3757577.0,255242.0,2.0,,,,,,,,,,,,,,,,
499,08/01/1988 12:00:00 AM,1988-08-01,1988,,,,,,,,,,,,,,,3388548.0,622505527.0,3009309.0,3959783.0,256188.0,2.0,,,,,,,,,,,,,,,,
500,09/01/1988 12:00:00 AM,1988-09-01,1988,,,,,,,,,,,,,,,3016533.0,453463218.0,2973850.0,3747636.0,243890.0,2.0,,,,,,,,,,,,,,,,
501,10/01/1988 12:00:00 AM,1988-10-01,1988,,,,,,,,,,,,,,,3111015.0,466272584.0,2967540.0,3770284.0,254656.0,2.0,,,,,,,,,,,,,,,,
502,11/01/1988 12:00:00 AM,1988-11-01,1988,,,,,,,,,,,,,,,3103388.0,463915317.0,2952341.0,3669620.0,244097.0,2.0,,,,,,,,,,,,,,,,
503,12/01/1988 12:00:00 AM,1988-12-01,1988,,,,,,,,,,,,,,,2980971.0,508813528.0,2967515.0,3739589.0,255200.0,2.0,,,,,,,,,,,,,,,,
504,01/01/1989 12:00:00 AM,1989-01-01,1989,,,,,,,408900.0,1199035.0,,,,,,,2999216.0,469510726.0,4256064.0,3858967.0,41507.0,2.0,,,,,,,,,,,,,,,,
505,02/01/1989 12:00:00 AM,1989-02-01,1989,,,,,,,442989.0,1172866.0,,,,,,,2785225.0,434694155.0,3883985.0,3551268.0,37261.0,2.0,,,,,,,,,,,,,,,,
506,03/01/1989 12:00:00 AM,1989-03-01,1989,,,,,,,442634.0,1217920.0,,,,,,,3236645.0,550044172.0,3084111.0,3944396.0,256222.0,2.0,,,,,,,,,,,,,,,,
507,04/01/1989 12:00:00 AM,1989-04-01,1989,,,,,,,555066.0,1586581.0,,,,,,,3169046.0,523064606.0,3039109.0,3839813.0,246087.0,2.0,,,,,,,,,,,,,,,,
508,05/01/1989 12:00:00 AM,1989-05-01,1989,,,,,,,437692.0,1256669.0,,,,,,,3358854.0,535726497.0,3166762.0,4081932.0,255914.0,2.0,,,,,,,,,,,,,,,,
509,06/01/1989 12:00:00 AM,1989-06-01,1989,,,,,,,427200.0,1198370.0,,,,,,,3312222.0,552382730.0,3154587.0,4016634.0,250060.0,2.0,,,,,,,,,,,,,,,,
510,07/01/1989 12:00:00 AM,1989-07-01,1989,,,,,,,531988.0,1366788.0,,,,,,,3261690.0,587853863.0,3241076.0,3883498.0,256985.0,2.0,,,,,,,,,,,,,,,,
511,08/01/1989 12:00:00 AM,1989-08-01,1989,,,,,,,446898.0,1229669.0,,,,,,,3457783.0,610136410.0,3285655.0,4095795.0,258228.0,2.0,,,,,,,,,,,,,,,,
512,09/01/1989 12:00:00 AM,1989-09-01,1989,,,,,,,574760.0,1535582.0,,,,,,,3116073.0,476859869.0,3121841.0,3814913.0,249332.0,2.0,,,,,,,,,,,,,,,,
513,10/01/1989 12:00:00 AM,1989-10-01,1989,,,,,,,488901.0,1264146.0,,,,,,,3259384.0,493441341.0,3243676.0,4041438.0,255445.0,2.0,,,,,,,,,,,,,,,,
514,11/01/1989 12:00:00 AM,1989-11-01,1989,,,,,,,453325.0,1208467.0,,,,,,,3215293.0,489801394.0,3190792.0,3902820.0,245759.0,2.0,,,,,,,,,,,,,,,,
515,12/01/1989 12:00:00 AM,1989-12-01,1989,,,,,,,542972.0,1400919.0,,,,,,,3045824.0,514837659.0,3276301.0,4056777.0,255372.0,2.0,,,,,,,,,,,,,,,,
516,01/01/1990 12:00:00 AM,1990-01-01,1990,,,,,,,422720.0,1170820.0,,,,,,,3036227.0,454115779.0,3313933.0,4047428.0,255715.0,2.0,,,,,,,,,,,,,,,,
517,02/01/1990 12:00:00 AM,1990-02-01,1990,,,,,,,453431.0,1214010.0,,,,,,,2898964.0,435086002.0,3043228.0,3721556.0,259856.0,2.0,,,,,,,,,,,,,,,,
518,03/01/1990 12:00:00 AM,1990-03-01,1990,,,,,,,578304.0,1546548.0,,,,,,,3357853.0,568289732.0,3359064.0,4180909.0,270110.0,2.0,,,,,,,,,,,,,,,,
519,04/01/1990 12:00:00 AM,1990-04-01,1990,,,,,,,444651.0,1240790.0,,,,,,,3320439.0,568101697.0,3273832.0,3967407.0,260389.0,2.0,,,,,,,,,,,,,,,,
520,05/01/1990 12:00:00 AM,1990-05-01,1990,,,,,,,449882.0,1260637.0,,,,,,,3300195.0,539628385.0,3402071.0,4195187.0,261446.0,2.0,,,,,,,,,,,,,,,,
521,06/01/1990 12:00:00 AM,1990-06-01,1990,,,,,,,558300.0,1553556.0,,,,,,,3276973.0,570694457.0,3348164.0,4110336.0,262109.0,2.0,,,,,,,,,,,,,,,,
522,07/01/1990 12:00:00 AM,1990-07-01,1990,,,,,,,432607.0,1170365.0,,,,,,,3372917.0,618571581.0,3416483.0,4495852.0,261422.0,2.0,,,,,,,,,,,,,,,,
523,08/01/1990 12:00:00 AM,1990-08-01,1990,,,,,,,462923.0,1226472.0,,,,,,,3368443.0,609210368.0,3446940.0,3756997.0,270203.0,2.0,,,,,,,,,,,,,,,,
524,09/01/1990 12:00:00 AM,1990-09-01,1990,,,,,,,597661.0,1541283.0,,,,,,,3073787.0,488444939.0,3269824.0,3913335.0,254621.0,2.0,,,,,,,,,,,,,,,,
525,10/01/1990 12:00:00 AM,1990-10-01,1990,,,,,,,497896.0,1247390.0,,,,,,,3291394.0,514253920.0,3613612.0,4140351.0,269333.0,2.0,,,,,,,,,,,,,,,,
526,11/01/1990 12:00:00 AM,1990-11-01,1990,,,,,,,463554.0,1177975.0,,,,,,,3181611.0,516429873.0,3356131.0,3911772.0,252853.0,2.0,,,,,,,,,,,,,,,,
527,12/01/1990 12:00:00 AM,1990-12-01,1990,,,,,,,566873.0,1400026.0,,,,,,,3023138.0,531619395.0,3395859.0,4015812.0,260517.0,2.0,,,,,,,,,,,,,,,,
528,01/01/1991 12:00:00 AM,1991-01-01,1991,,,,,,,416515.0,1073506.0,,,,,,,3097361.0,496467387.0,3174949.0,4113356.0,253166.0,2.0,,,,,,,,,,,,,,,,
529,02/01/1991 12:00:00 AM,1991-02-01,1991,,,,,,,454338.0,1160300.0,,,,,,,2891106.0,469504489.0,3078234.0,3709558.0,235957.0,2.0,,,,,,,,,,,,,,,,
530,03/01/1991 12:00:00 AM,1991-03-01,1991,,,,,,,558872.0,1438071.0,,,,,,,3243410.0,587905914.0,3422738.0,3997287.0,271345.0,2.0,,,,,,,,,,,,,,,,
531,04/01/1991 12:00:00 AM,1991-04-01,1991,,,,,,,407609.0,1140126.0,,,,,,,3141980.0,509488334.0,3283384.0,4058620.0,261902.0,2.0,,,,,,,,,,,,,,,,
532,05/01/1991 12:00:00 AM,1991-05-01,1991,,,,,,,442471.0,1170646.0,,,,,,,3220867.0,566342448.0,3456623.0,4158573.0,263323.0,2.0,,,,,,,,,,,,,,,,
533,06/01/1991 12:00:00 AM,1991-06-01,1991,,,,,,,565684.0,1452436.0,,,,,,,3230739.0,603845247.0,3418914.0,3958934.0,263590.0,2.0,,,,,,,,,,,,,,,,
534,07/01/1991 12:00:00 AM,1991-07-01,1991,,,,,,,440641.0,1106481.0,,,,,,,3351988.0,633450001.0,3521275.0,4016734.0,262249.0,2.0,,,,,,,,,,,,,,,,
535,08/01/1991 12:00:00 AM,1991-08-01,1991,,,,,,,607400.0,1528502.0,,,,,,,3365286.0,664013874.0,3505725.0,4111875.0,271615.0,2.0,,,,,,,,,,,,,,,,
536,09/01/1991 12:00:00 AM,1991-09-01,1991,,,,,,,492606.0,1215422.0,,,,,,,3051106.0,494557648.0,3344412.0,3928465.0,255398.0,2.0,,,,,,,,,,,,,,,,
537,10/01/1991 12:00:00 AM,1991-10-01,1991,,,,,,,518802.0,1249012.0,,,,,,,3035491.0,509037626.0,3205728.0,4233577.0,271601.0,2.0,,,,,,,,,,,,,,,,
538,11/01/1991 12:00:00 AM,1991-11-01,1991,,,,,,,618706.0,1460491.0,,,,,,,2872184.0,472359118.0,3104234.0,3840021.0,253273.0,2.0,,,,,,,,,,,,,,,,
539,12/01/1991 12:00:00 AM,1991-12-01,1991,,,,,,,462752.0,1122756.0,,,,,,,3088620.0,550795984.0,3221896.0,3825335.0,261361.0,2.0,,,,,,,,,,,,,,,,
540,01/01/1992 12:00:00 AM,1992-01-01,1992,,,,,,,433126.0,1100714.0,,,,,,,2953192.0,493541137.0,3578455.0,4025289.0,254314.0,2.0,,,,,,,,,,,,,,,,
541,02/01/1992 12:00:00 AM,1992-02-01,1992,,,,,,,599589.0,1467190.0,,,,,,,2814366.0,462084011.0,3322699.0,3699311.0,236230.0,2.0,,,,,,,,,,,,,,,,
542,03/01/1992 12:00:00 AM,1992-03-01,1992,,,,,,,479186.0,1178134.0,,,,,,,3235404.0,559205172.0,3608238.0,4066795.0,270156.0,2.0,,,,,,,,,,,,,,,,
543,04/01/1992 12:00:00 AM,1992-04-01,1992,,,,,,,479001.0,1173069.0,,,,,,,3250776.0,572122965.0,3505924.0,3937293.0,261320.0,2.0,,,,,,,,,,,,,,,,
544,05/01/1992 12:00:00 AM,1992-05-01,1992,,,,,,,599676.0,1484144.0,,,,,,,3437451.0,546043825.0,3563754.0,3967554.0,262549.0,2.0,,,,,,,,,,,,,,,,
545,06/01/1992 12:00:00 AM,1992-06-01,1992,,,,,,,465797.0,1156433.0,,,,,,,3018138.0,478204759.0,3277368.0,3971745.0,262847.0,2.0,,,,,,,,,,,,,,,,
546,07/01/1992 12:00:00 AM,1992-07-01,1992,,,,,,,478948.0,1139392.0,,,,,,,3337720.0,610774196.0,3694025.0,4132381.0,262572.0,2.0,,,,,,,,,,,,,,,,
547,08/01/1992 12:00:00 AM,1992-08-01,1992,,,,,,,632571.0,1513314.0,,,,,,,3425174.0,627359211.0,3689030.0,4045132.0,272166.0,2.0,,,,,,,,,,,,,,,,
548,09/01/1992 12:00:00 AM,1992-09-01,1992,,,,,,,520162.0,1197401.0,,,,,,,3084837.0,516516158.0,3572052.0,4015013.0,255564.0,2.0,,,,,,,,,,,,,,,,
549,10/01/1992 12:00:00 AM,1992-10-01,1992,,,,,,,689643.0,1539418.0,,,,,,,3181422.0,538313763.0,3692566.0,4244756.0,269398.0,2.0,,,,,,,,,,,,,,,,
550,11/01/1992 12:00:00 AM,1992-11-01,1992,,,,,,,509226.0,1184312.0,,,,,,,3185873.0,539769246.0,3601335.0,3898735.0,251537.0,2.0,,,,,,,,,,,,,,,,
551,12/01/1992 12:00:00 AM,1992-12-01,1992,,,,,,,495388.0,1154007.0,,,,,,,3158046.0,551397116.0,3712953.0,3941180.0,260064.0,2.0,,,,,,,,,,,,,,,,
552,01/01/1993 12:00:00 AM,1993-01-01,1993,,,,,,,590548.0,1406790.0,,,,,,,3054123.0,500349189.0,3608667.0,4016468.0,200210.0,2.0,,,,,,,,,,,,,,,,
553,02/01/1993 12:00:00 AM,1993-02-01,1993,,,,,,,501102.0,1149975.0,,,,,,,2937448.0,461280157.0,3305329.0,3811175.0,186032.0,2.0,,,,,,,,,,,,,,,,
554,03/01/1993 12:00:00 AM,1993-03-01,1993,,,,,,,528738.0,1156511.0,,,,,,,3287516.0,534476186.0,3670178.0,4353403.0,212832.0,2.0,,,,,,,,,,,,,,,,
555,04/01/1993 12:00:00 AM,1993-04-01,1993,,,,,,,512909.0,1200078.0,,,,,,,3304762.0,562429065.0,3600733.0,4118114.0,206322.0,2.0,,,,,,,,,,,,,,,,
556,05/01/1993 12:00:00 AM,1993-05-01,1993,,,,,,,657370.0,1528423.0,,,,,,,3267243.0,554039017.0,3686558.0,4194770.0,207990.0,2.0,,,,,,,,,,,,,,,,
557,06/01/1993 12:00:00 AM,1993-06-01,1993,,,,,,,518011.0,1186033.0,,,,,,,3395962.0,580500717.0,3658547.0,4257141.0,206707.0,2.0,,,,,,,,,,,,,,,,
558,07/01/1993 12:00:00 AM,1993-07-01,1993,,,,,,,632349.0,1400396.0,,,,,,,3370573.0,586861727.0,3741280.0,4085987.0,204361.0,2.0,,,,,,,,,,,,,,,,
559,08/01/1993 12:00:00 AM,1993-08-01,1993,,,,,,,540426.0,1153403.0,,,,,,,3505918.0,611839976.0,3760693.0,4202455.0,213213.0,2.0,,,,,,,,,,,,,,,,
560,09/01/1993 12:00:00 AM,1993-09-01,1993,,,,,,,556295.0,1190479.0,,,,,,,3158100.0,501353952.0,3630214.0,4365296.0,201084.0,2.0,,,,,,,,,,,,,,,,
561,10/01/1993 12:00:00 AM,1993-10-01,1993,,,,,,,746584.0,1555046.0,,,,,,,3218031.0,507702230.0,3766372.0,4209811.0,217674.0,2.0,,,,,,,,,,,,,,,,
562,11/01/1993 12:00:00 AM,1993-11-01,1993,,,,,,,557225.0,1190955.0,,,,,,,3215947.0,489299178.0,3561630.0,4030402.0,197707.0,2.0,,,,,,,,,,,,,,,,
563,12/01/1993 12:00:00 AM,1993-12-01,1993,,,,,,,552546.0,1190370.0,,,,,,,3111083.0,503041903.0,3692885.0,3999055.0,203081.0,2.0,,,,,,,,,,,,,,,,
564,01/01/1994 12:00:00 AM,1994-01-01,1994,,,,,,,618457.0,1374349.0,,,,,,,3150985.0,472917856.0,3539097.0,4154780.0,198044.0,2.0,,,,,,,,,,,,,,,,
565,02/01/1994 12:00:00 AM,1994-02-01,1994,,,,,,,565726.0,1196163.0,,,,,,,3092354.0,463567851.0,4097509.0,3876554.0,184488.0,2.0,,,,,,,,,,,,,,,,
566,03/01/1994 12:00:00 AM,1994-03-01,1994,,,,,,,590445.0,1247952.0,,,,,,,3481677.0,572167273.0,3669052.0,4384043.0,210612.0,2.0,,,,,,,,,,,,,,,,
567,04/01/1994 12:00:00 AM,1994-04-01,1994,,,,,,,743051.0,1561757.0,,,,,,,3308812.0,546898075.0,3522919.0,4125356.0,209362.0,2.0,,,,,,,,,,,,,,,,
568,05/01/1994 12:00:00 AM,1994-05-01,1994,,,,,,,615792.0,1276611.0,,,,,,,3397517.0,524008197.0,3639315.0,4274055.0,205165.0,2.0,,,,,,,,,,,,,,,,
569,06/01/1994 12:00:00 AM,1994-06-01,1994,,,,,,,599068.0,1233296.0,,,,,,,3397045.0,531971149.0,3568609.0,3698083.0,206562.0,2.0,,,,,,,,,,,,,,,,
570,07/01/1994 12:00:00 AM,1994-07-01,1994,,,,,,,740639.0,1493739.0,,,,,,,3471268.0,578257564.0,3642983.0,4123484.0,205426.0,2.0,,,,,,,,,,,,,,,,
571,08/01/1994 12:00:00 AM,1994-08-01,1994,,,,,,,629340.0,1295939.0,,,,,,,3619233.0,587229076.0,3708206.0,4529251.0,213300.0,2.0,,,,,,,,,,,,,,,,
572,09/01/1994 12:00:00 AM,1994-09-01,1994,,,,,,,627243.0,1277964.0,,,,,,,3312771.0,490032783.0,3556231.0,4199036.0,202378.0,2.0,,,,,,,,,,,,,,,,
573,10/01/1994 12:00:00 AM,1994-10-01,1994,,,,,,,840075.0,1644052.0,,,,,,,3436149.0,493619903.0,3628679.0,4312674.0,211134.0,2.0,,,,,,,,,,,,,,,,
574,11/01/1994 12:00:00 AM,1994-11-01,1994,,,,,,,631349.0,1252328.0,,,,,,,3412984.0,477594716.0,3591495.0,4302015.0,198312.0,2.0,,,,,,,,,,,,,,,,
575,12/01/1994 12:00:00 AM,1994-12-01,1994,,,,,,,748714.0,1570070.0,,,,,,,3291265.0,490779357.0,3762147.0,4060031.0,203048.0,2.0,,,,,,,,,,,,,,,,
576,01/01/1995 12:00:00 AM,1995-01-01,1995,,,,,,,567313.0,1237323.0,,,,,,,3209841.0,425207429.0,3543608.0,3874957.0,153915.0,2.0,,,,,,,,,,,,,,,,
577,02/01/1995 12:00:00 AM,1995-02-01,1995,,,,,,,602372.0,1283208.0,,,,,,,3053626.0,393268412.0,3062154.0,3689979.0,144176.0,2.0,,,,,,,,,,,,,,,,
578,03/01/1995 12:00:00 AM,1995-03-01,1995,,,,,,,608743.0,1283302.0,,,,,,,3413313.0,489360683.0,3440449.0,4121952.0,169672.0,2.0,,,,,,,,,,,,,,,,
579,04/01/1995 12:00:00 AM,1995-04-01,1995,,,,,,,755407.0,1617526.0,,,,,,,3356446.0,490903635.0,3135433.0,3750132.0,159514.0,2.0,,,,,,,,,,,,,,,,
580,05/01/1995 12:00:00 AM,1995-05-01,1995,,,,,,,599437.0,1292896.0,,,,,,,3463527.0,511120586.0,3308494.0,3732267.0,161967.0,2.0,,,,,,,,,,,,,,,,
581,06/01/1995 12:00:00 AM,1995-06-01,1995,,,,,,,577352.0,1251183.0,,,,,,,3353598.0,542693418.0,3140872.0,3977164.0,163375.0,2.0,,,,,,,,,,,,,,,,
582,07/01/1995 12:00:00 AM,1995-07-01,1995,,,,,,,726462.0,1535888.0,,,,,,,3431899.0,571259638.0,3179631.0,3878164.0,161742.0,2.0,,,,,,,,,,,,,,,,
583,08/01/1995 12:00:00 AM,1995-08-01,1995,,,,,,,610885.0,1292541.0,,,,,,,3552940.0,580982161.0,3226213.0,3740261.0,173050.0,2.0,,,,,,,,,,,,,,,,
584,09/01/1995 12:00:00 AM,1995-09-01,1995,,,,,,,781336.0,1667469.0,,,,,,,3208323.0,451385426.0,3043263.0,3765409.0,159009.0,2.0,,,,,,,,,,,,,,,,
585,10/01/1995 12:00:00 AM,1995-10-01,1995,,,,,,,654296.0,1317101.0,,,,,,,3325631.0,441202778.0,3137927.0,4004163.0,167580.0,2.0,,,,,,,,,,,,,,,,
586,11/01/1995 12:00:00 AM,1995-11-01,1995,,,,,,,599904.0,1260196.0,,,,,,,3210029.0,435470011.0,3623374.0,3727936.0,156520.0,2.0,,,,,,,,,,,,,,,,
587,12/01/1995 12:00:00 AM,1995-12-01,1995,,,,,,,716391.0,1543721.0,,,,,,,3119053.0,444598571.0,3114921.0,3659487.0,159214.0,2.0,,,,,,,,,,,,,,,,
588,01/01/1996 12:00:00 AM,1996-01-01,1996,,,,,,,546419.0,1150794.0,,,,,,,2990875.0,362022328.0,3053546.0,3967896.0,154884.0,2.0,,,,,419175.0,255176.0,,,,,,,,,,
589,02/01/1996 12:00:00 AM,1996-02-01,1996,,,,,,,594547.0,1200621.0,,,,,,,2965922.0,343413949.0,2975275.0,3639347.0,144547.0,2.0,,,,,434019.0,258334.0,,,,,,,,,,
590,03/01/1996 12:00:00 AM,1996-03-01,1996,,,,,,,757273.0,1601639.0,,,,,,,3104832.0,416042895.0,3115320.0,3864706.0,169612.0,2.0,,,,,449155.0,269872.0,,,,,,,,,,
591,04/01/1996 12:00:00 AM,1996-04-01,1996,,,,,,,589944.0,1290495.0,,,,,,,3235894.0,425092726.0,3027555.0,3754950.0,159443.0,2.0,,,,,448844.0,241608.0,,,,,,,,,,
592,05/01/1996 12:00:00 AM,1996-05-01,1996,,,,,,,607450.0,1302099.0,,,,,,,3371160.0,467573082.0,3141509.0,3926463.0,160445.0,2.0,,,,,479137.0,279286.0,,,,,,,,,,
593,06/01/1996 12:00:00 AM,1996-06-01,1996,,,,,,,760808.0,1594718.0,,,,,,,1809256.0,476554648.0,2716298.0,3414004.0,161065.0,2.0,,,,,454740.0,263040.0,,,,,,,,,,
594,07/01/1996 12:00:00 AM,1996-07-01,1996,,,,,,,580633.0,1213607.0,,,,,,,1971486.0,525954361.0,2731264.0,3543506.0,161975.0,2.0,,,,,438413.0,269974.0,,,,,,,,,,
595,08/01/1996 12:00:00 AM,1996-08-01,1996,,,,,,,809462.0,1640436.0,,,,,,,2078166.0,551695523.0,2835613.0,3572978.0,170868.0,2.0,,,,,470139.0,275565.0,,,,,,,,,,
596,09/01/1996 12:00:00 AM,1996-09-01,1996,,,,,,,648553.0,1277646.0,,,,,,,1608040.0,412344840.0,2688612.0,3096507.0,154988.0,2.0,,,,,458830.0,252736.0,,,,,,,,,,
597,10/01/1996 12:00:00 AM,1996-10-01,1996,,,,,,,689524.0,1326847.0,,,,,,,1689996.0,425991795.0,2805129.0,3682284.0,165348.0,2.0,,,,,507303.0,314510.0,,,,,,,,,,
598,11/01/1996 12:00:00 AM,1996-11-01,1996,,,,,,,817526.0,1594818.0,,,,,,,1581188.0,389249720.0,2732435.0,3378351.0,150635.0,2.0,,,,,459296.0,292096.0,,,,,,,,,,
599,12/01/1996 12:00:00 AM,1996-12-01,1996,,,,,,,594101.0,1205691.0,,,,,,,1703378.0,437256586.0,2879697.0,3757265.0,160060.0,2.0,,,,,412045.0,281887.0,,,,,,,,,,
600,01/01/1997 12:00:00 AM,1997-01-01,1997,,,,,,,569489.0,1175590.0,,,,,,,1398967.0,337798678.0,3328713.0,3577885.0,180185.0,2.0,,,,,473867.0,299793.0,,,,,,,,,,
601,02/01/1997 12:00:00 AM,1997-02-01,1997,,,,,,,644108.0,1274843.0,,,,,,,1399987.0,337893100.0,3303546.0,3187892.0,157812.0,2.0,,,,,463472.0,290845.0,,,,,,,,,,
602,03/01/1997 12:00:00 AM,1997-03-01,1997,,,,,,,813057.0,1610799.0,,,,,,,1713561.0,416925515.0,3318158.0,3448021.0,170087.0,2.0,,,,,482040.0,291100.0,,,,,,,,,,
603,04/01/1997 12:00:00 AM,1997-04-01,1997,,,,,,,649040.0,1269132.0,,,,,,,1659157.0,408488665.0,3236239.0,3598016.0,170835.0,2.0,,,,,503242.0,314517.0,,,,,,,,,,
604,05/01/1997 12:00:00 AM,1997-05-01,1997,,,,,,,813186.0,1598247.0,,,,,,,1815079.0,444032624.0,3370616.0,3603905.0,199264.0,2.0,,,,,499055.0,307247.0,,,,,,,,,,
605,06/01/1997 12:00:00 AM,1997-06-01,1997,,,,,,,681260.0,1293668.0,,,,,,,1903113.0,481053743.0,3256726.0,3528974.0,174866.0,2.0,,,,,500868.0,306257.0,,,,,,,,,,
606,07/01/1997 12:00:00 AM,1997-07-01,1997,,,,,,,643286.0,1218539.0,,,,,,,2111040.0,540293509.0,3414323.0,3822281.0,215510.0,2.0,,,,,460960.0,309583.0,,,,,,,,,,
607,08/01/1997 12:00:00 AM,1997-08-01,1997,,,,,,,852520.0,1631498.0,,,,,,,2174236.0,552486079.0,3040550.0,3571261.0,207744.0,2.0,,,,,474190.0,300610.0,,,,,,,,,,
608,09/01/1997 12:00:00 AM,1997-09-01,1997,,,,,,,689141.0,1286267.0,,,,,,,1676933.0,425814893.0,2922788.0,3690784.0,195665.0,2.0,,,,,510671.0,318753.0,,,,,,,,,,
609,10/01/1997 12:00:00 AM,1997-10-01,1997,,,,,,,711322.0,1311195.0,,,,,,,1778068.0,445858326.0,3028937.0,3791932.0,208657.0,2.0,,,,,516240.0,343053.0,,,,,,,,,,
610,11/01/1997 12:00:00 AM,1997-11-01,1997,,,,,,,845885.0,1574213.0,,,,,,,1735641.0,441249575.0,2921509.0,3403290.0,189114.0,2.0,,,,,490730.0,301296.0,,,,,,,,,,
611,12/01/1997 12:00:00 AM,1997-12-01,1997,,,,,,,620751.0,1243215.0,,,,,,,1799564.0,454400575.0,3003478.0,3539698.0,199655.0,2.0,,,,,451639.0,306611.0,,,,,,,,,,
612,01/01/1998 12:00:00 AM,1998-01-01,1998,,,,,,,752801.0,1578827.0,,,,,,,1573034.0,371355589.0,2994789.0,3611005.0,206113.0,2.0,,,,,487587.0,318380.0,,,,,,,,,,
613,02/01/1998 12:00:00 AM,1998-02-01,1998,,,,,,,639807.0,1282440.0,,,,,,,1416842.0,326874247.0,2970330.0,3365570.0,181700.0,2.0,,,,,490822.0,309688.0,,,,,,,,,,
614,03/01/1998 12:00:00 AM,1998-03-01,1998,,,,,,,662775.0,1283250.0,,,,,,,1758974.0,426172239.0,3044212.0,3784360.0,203393.0,2.0,,,,,554052.0,353328.0,,,,,,,,,,
615,04/01/1998 12:00:00 AM,1998-04-01,1998,,,,,,,660210.0,1292437.0,,,,,,,1829817.0,447877815.0,2966276.0,3665648.0,199367.0,2.0,,,,,535958.0,343816.0,,,,,,,,,,
616,05/01/1998 12:00:00 AM,1998-05-01,1998,,,,,,,819636.0,1643668.0,,,,,,,1898488.0,462341914.0,3104841.0,3704016.0,204320.0,2.0,,,,,535394.0,329961.0,,,,,,,,,,
617,06/01/1998 12:00:00 AM,1998-06-01,1998,,,,,,,680092.0,1314579.0,,,,,,,1925774.0,482325897.0,3061691.0,3873538.0,207232.0,2.0,,,,,539513.0,339169.0,,,,,,,,,,
618,07/01/1998 12:00:00 AM,1998-07-01,1998,,,,,,,634669.0,1225259.0,,,,,,,2141613.0,537481124.0,3154295.0,3925805.0,223098.0,2.0,,,,,483125.0,321469.0,,,,,,,,,,
619,08/01/1998 12:00:00 AM,1998-08-01,1998,,,,,,,862535.0,1655125.0,,,,,,,2083037.0,526444502.0,3064411.0,3797148.0,213238.0,2.0,,,,,525098.0,316024.0,,,,,,,,,,
620,09/01/1998 12:00:00 AM,1998-09-01,1998,,,,,,,680376.0,1337159.0,,,,,,,1731345.0,430364874.0,2985583.0,3795589.0,200292.0,2.0,,,,,558764.0,329505.0,,,,,,,,,,
621,10/01/1998 12:00:00 AM,1998-10-01,1998,,,,,,,903071.0,1697055.0,,,,,,,1796119.0,444719403.0,3084853.0,3843193.0,210010.0,2.0,,,,,541898.0,329285.0,,,,,,,,,,
622,11/01/1998 12:00:00 AM,1998-11-01,1998,,,,,,,678419.0,1290413.0,,,,,,,1819527.0,427669956.0,3006226.0,3650969.0,189863.0,2.0,,,,,528285.0,329426.0,,,,,,,,,,
623,12/01/1998 12:00:00 AM,1998-12-01,1998,,,,,,,637742.0,1252061.0,,,,,,,1849336.0,459051399.0,3069674.0,3627003.0,177062.0,2.0,,,,,490438.0,326492.0,,,,,,,,,,
624,01/01/1999 12:00:00 AM,1999-01-01,1999,,,,,,,761278.0,1515143.0,,,,,,,1601532.0,384824724.0,3087577.0,3797055.0,210035.0,2.0,,,,,520907.0,320144.0,,,,,,,,,,
625,02/01/1999 12:00:00 AM,1999-02-01,1999,,,,,,,675158.0,1317722.0,,,,,,,1550245.0,350270063.0,2805493.0,3499916.0,182372.0,2.0,,,,,524723.0,338269.0,,,,,,,,,,
626,03/01/1999 12:00:00 AM,1999-03-01,1999,,,,,,,668123.0,1295321.0,,,,,,,1835025.0,436837107.0,3144895.0,4045745.0,204447.0,2.0,,,,,594737.0,408162.0,,,,,,,,,,
627,04/01/1999 12:00:00 AM,1999-04-01,1999,,,,,,,657810.0,1278598.0,,,,,,,1843867.0,435360347.0,3071044.0,3857590.0,201558.0,2.0,,,,,572772.0,365208.0,,,,,,,,,,
628,05/01/1999 12:00:00 AM,1999-05-01,1999,,,,,,,859595.0,1656167.0,,,,,,,1912287.0,450054655.0,3181470.0,3914419.0,207460.0,2.0,,,,,571670.0,359245.0,,,,,,,,,,
629,06/01/1999 12:00:00 AM,1999-06-01,1999,,,,,,,671530.0,1254504.0,,,,,,,2014835.0,496553598.0,3142757.0,4015672.0,211982.0,2.0,,,,,596134.0,379890.0,,,,,,,,,,
630,07/01/1999 12:00:00 AM,1999-07-01,1999,,,,,,,833676.0,1549202.0,,,,,,,2132858.0,543923323.0,3244917.0,4007649.0,228646.0,2.0,,,,,517183.0,360473.0,,,,,,,,,,
631,08/01/1999 12:00:00 AM,1999-08-01,1999,,,,,,,704998.0,1322341.0,,,,,,,2099737.0,528001216.0,3246178.0,4087939.0,216773.0,2.0,,,,,597454.0,365554.0,,,,,,,,,,
632,09/01/1999 12:00:00 AM,1999-09-01,1999,,,,,,,711818.0,1317686.0,,,,,,,1701827.0,393137094.0,2992076.0,3884533.0,199663.0,2.0,,,,,588852.0,361516.0,,,,,,,,,,
633,10/01/1999 12:00:00 AM,1999-10-01,1999,,,,,,,941317.0,1679031.0,,,,,,,1809743.0,425897553.0,3206974.0,3961885.0,212887.0,2.0,,,,,601920.0,373179.0,,,,,,,,,,
634,11/01/1999 12:00:00 AM,1999-11-01,1999,,,,,,,702144.0,1293011.0,,,,,,,1852808.0,421595015.0,3116115.0,3816626.0,193987.0,2.0,,,,,599462.0,374104.0,,,,,,,,,,
635,12/01/1999 12:00:00 AM,1999-12-01,1999,,,,,,,671583.0,1294628.0,,,,,,,1840903.0,442742459.0,3203228.0,3797569.0,221003.0,2.0,,,,,531633.0,352977.0,,,,,,,,,,
636,01/01/2000 12:00:00 AM,2000-01-01,2000,,,,,,,785032.0,1534829.0,,,,,,,1543871.0,366607410.0,3178238.0,3884956.0,200487.0,2.0,,105.3,94.8,101.8,562610.0,357426.0,,,80.3,,,,,,,
637,02/01/2000 12:00:00 AM,2000-02-01,2000,,,,,,,688698.0,1286745.0,,,,,,,1618764.0,366139276.0,3029921.0,3728990.0,190075.0,2.0,,104.4,98.1,102.3,573543.0,377296.0,,,79.8,,,,,,,
638,03/01/2000 12:00:00 AM,2000-03-01,2000,,,,,,,687520.0,1313136.0,,,,,,,1924055.0,453096388.0,3264900.0,4095524.0,210315.0,2.0,,99.2,99.0,99.1,636750.0,414412.0,,,74.1,,,,,,,
639,04/01/2000 12:00:00 AM,2000-04-01,2000,,,,,,,877860.0,1621872.0,,,,,,,1977517.0,473751011.0,3137423.0,3724866.0,203171.0,2.0,,98.1,99.4,98.5,574997.0,359239.0,,,72.8,,,,,,,
640,05/01/2000 12:00:00 AM,2000-05-01,2000,,,,,,,710002.0,1311448.0,,,,,,,2053643.0,481725263.0,3295481.0,4119189.0,229033.0,2.0,,98.6,101.2,99.4,635253.0,401676.0,,,73.0,,,,,,,
641,06/01/2000 12:00:00 AM,2000-06-01,2000,,,,,,,691156.0,1281098.0,,,,,,,2128695.0,517102460.0,3228546.0,3950579.0,208562.0,2.0,,99.6,101.4,100.2,613340.0,399610.0,,,74.9,,,,,,,
642,07/01/2000 12:00:00 AM,2000-07-01,2000,,,,,,,868016.0,1568243.0,,,,,,,2179403.0,564747276.0,3306932.0,3935743.0,208310.0,2.0,,97.4,100.9,98.6,528835.0,357425.0,,,72.6,,,,,,,
643,08/01/2000 12:00:00 AM,2000-08-01,2000,,,,,,,730958.0,1323293.0,,,,,,,2213683.0,558060051.0,3343198.0,4093007.0,214358.0,2.0,,99.6,99.9,99.7,631873.0,410903.0,,,74.7,,,,,,,
644,09/01/2000 12:00:00 AM,2000-09-01,2000,,,,,,,924993.0,1671373.0,,,,,,,1880892.0,446489429.0,3213223.0,3891056.0,204935.0,2.0,,99.7,103.5,100.9,588557.0,366768.0,,,74.1,,,,,,,
645,10/01/2000 12:00:00 AM,2000-10-01,2000,,,,,,,777301.0,1343022.0,,,,,,,1979403.0,462329685.0,1944302.0,4100880.0,233139.0,2.0,,99.5,101.8,100.3,626833.0,388288.0,,,74.2,,,,,,,
646,11/01/2000 12:00:00 AM,2000-11-01,2000,,,,,,,704168.0,1250982.0,,,,,,,1982030.0,442268378.0,3214792.0,3935939.0,198536.0,2.0,,99.8,101.4,100.4,600470.0,363937.0,,,74.8,,,,,,,
647,12/01/2000 12:00:00 AM,2000-12-01,2000,,,,,,,825656.0,1503261.0,,,,,,,2001810.0,461651082.0,3265043.0,3685066.0,204215.0,2.0,,98.9,98.6,98.9,475067.0,328599.0,,,74.2,,,,,,,
648,01/01/2001 12:00:00 AM,2001-01-01,2001,,,,,,,632574.0,1231441.0,,,,,,,1683799.0,379458113.0,3278833.0,3834634.0,202582.0,2.0,,99.5,100.2,99.8,579172.0,359459.0,,,74.8,,,,,,,
649,02/01/2001 12:00:00 AM,2001-02-01,2001,,,,,,,674473.0,1272223.0,,,,,,,1745627.0,366288212.0,3013676.0,3468671.0,191092.0,2.0,,99.8,99.7,99.9,532495.0,342476.0,,,75.2,,,,,,,
650,03/01/2001 12:00:00 AM,2001-03-01,2001,,,,,,,858603.0,1642226.0,,,,,,,2011105.0,448912584.0,3350323.0,3838789.0,214235.0,2.0,,99.1,100.8,99.6,596446.0,388393.0,,,74.2,,,,,,,
651,04/01/2001 12:00:00 AM,2001-04-01,2001,,,,,,,668745.0,1296834.0,,,,,,,2027208.0,455496342.0,3193056.0,3644452.0,184414.0,2.0,,98.1,101.3,99.1,568784.0,351934.0,,,73.5,,,,,,,
652,05/01/2001 12:00:00 AM,2001-05-01,2001,,,,,,,676990.0,1313949.0,,,,,,,2085933.0,462376555.0,3414322.0,3857375.0,230142.0,2.0,,99.3,101.3,100.0,625675.0,387767.0,,,75.3,,,,,,,
653,06/01/2001 12:00:00 AM,2001-06-01,2001,,,,,,,850158.0,1599629.0,,,,,,,2188063.0,528690495.0,3309971.0,3688314.0,213569.0,2.0,,98.4,101.9,99.5,585144.0,360917.0,,,74.3,,,,,,,
654,07/01/2001 12:00:00 AM,2001-07-01,2001,,,,,,,656948.0,1195385.0,,,,,,,2251180.0,564037290.0,3436118.0,3688620.0,216006.0,2.0,,97.6,102.2,99.0,528769.0,342869.0,,,74.1,,,,,,,
655,08/01/2001 12:00:00 AM,2001-08-01,2001,,,,,,,719937.0,1290093.0,,,,,,,2327134.0,562266005.0,3470372.0,3823082.0,220652.0,2.0,,99.3,102.9,100.4,600506.0,374216.0,,,75.2,,,,,,,
656,09/01/2001 12:00:00 AM,2001-09-01,2001,,,,,,,907808.0,1629724.0,,,,,,,1762273.0,446266947.0,3309637.0,3588402.0,206621.0,2.0,,98.1,82.9,93.7,542154.0,333294.0,,,74.4,,,,,,,
657,10/01/2001 12:00:00 AM,2001-10-01,2001,,,,,,,746453.0,1340970.0,,,,,,,1952178.0,452095177.0,3484415.0,3997244.0,236620.0,2.0,,98.8,85.0,94.8,607236.0,385399.0,,,74.5,,,,,,,
658,11/01/2001 12:00:00 AM,2001-11-01,2001,,,,,,,694750.0,1291270.0,,,,,,,1973972.0,446094295.0,3349413.0,3595400.0,210258.0,2.0,,98.0,88.7,95.4,555441.0,356274.0,,,74.6,,,,,,,
659,12/01/2001 12:00:00 AM,2001-12-01,2001,,,,,,,812203.0,1535490.0,,,,,,,1988189.0,479188686.0,3388866.0,3357846.0,177757.0,2.0,,97.6,90.4,95.6,455087.0,321961.0,,,74.3,,,,,,,
660,01/01/2002 12:00:00 AM,2002-01-01,2002,,,,11117998.0,430318522.0,276530991.0,617106.0,1207150.0,,,,,,,1759871.0,398443099.0,3449820.0,3753338.0,201805.0,2.0,,98.8,92.4,97.1,552363.0,362764.0,,,75.3,,,,,,,
661,02/01/2002 12:00:00 AM,2002-02-01,2002,,,,10801941.0,414396657.0,260745192.0,677156.0,1254276.0,,,,,,,1772163.0,397948979.0,3146083.0,3279163.0,192440.0,2.0,,100.2,94.1,98.6,535575.0,351653.0,,,76.7,,,,,,,
662,03/01/2002 12:00:00 AM,2002-03-01,2002,,,,11444827.0,440766593.0,288404172.0,862739.0,1551024.0,,,,,,,2021506.0,459147305.0,3474697.0,3462288.0,189907.0,2.0,,98.7,94.2,97.6,568295.0,378634.0,,,75.3,,,,,,,
663,04/01/2002 12:00:00 AM,2002-04-01,2002,,,,11701049.0,438453423.0,292201780.0,718490.0,1266853.0,,,,,,,2049477.0,453149024.0,3375089.0,3465832.0,183928.0,2.0,,99.9,94.6,98.5,603586.0,394378.0,,,76.0,,,,,,,
664,05/01/2002 12:00:00 AM,2002-05-01,2002,,,,12019400.0,441175267.0,298698607.0,740394.0,1287752.0,,,,,,,2114453.0,461622928.0,3544543.0,3594613.0,235836.0,2.0,,101.0,95.9,99.6,623411.0,387629.0,,,77.1,,,,,,,
665,06/01/2002 12:00:00 AM,2002-06-01,2002,,,,11561456.0,392447592.0,281666413.0,923983.0,1612738.0,,,,,,,2108990.0,499734575.0,3423311.0,3348673.0,215133.0,2.0,,101.4,95.8,99.9,577980.0,359260.0,,,76.9,,,,,,,
666,07/01/2002 12:00:00 AM,2002-07-01,2002,,,,12329521.0,406926078.0,288213526.0,712354.0,1214093.0,,,,,,,2252579.0,564023742.0,3519049.0,3422331.0,216418.0,2.0,,102.7,95.5,100.7,552454.0,375233.0,,,78.2,,,,,,,
667,08/01/2002 12:00:00 AM,2002-08-01,2002,,,,12545349.0,411507226.0,282873227.0,976731.0,1655223.0,,,,,,,2145056.0,516067118.0,3442490.0,3486738.0,221255.0,2.0,,102.5,96.1,100.8,596692.0,381991.0,,,78.2,,,,,,,
668,09/01/2002 12:00:00 AM,2002-09-01,2002,,,,11424483.0,437544341.0,280516224.0,772707.0,1302190.0,,,,,,,1795362.0,385089969.0,3357481.0,3300520.0,199570.0,2.0,,103.0,95.3,100.8,587262.0,349746.0,,,79.1,,,,,,,
669,10/01/2002 12:00:00 AM,2002-10-01,2002,,,,12011435.0,448205417.0,304493043.0,684334.0,1324163.0,,,,,,,1919552.0,399247828.0,3531369.0,3516510.0,261744.0,2.0,,104.5,96.2,102.1,632728.0,398319.0,,1887141507.16,79.1,1458665510.57,,,,,,
670,11/01/2002 12:00:00 AM,2002-11-01,2002,,,,10886753.0,415036745.0,277942752.0,936074.0,1591359.0,,,,,,,1860455.0,376011411.0,3362258.0,3138729.0,208824.0,2.0,,104.8,96.6,102.5,573418.0,357782.0,,1778562018.4899998,79.3,1296240597.46,,,,,,
671,12/01/2002 12:00:00 AM,2002-12-01,2002,,,,10607297.0,398274828.0,273559999.0,690292.0,1213719.0,,,,,,,2010859.0,448245893.0,3471202.0,3119488.0,216848.0,2.0,,105.0,96.5,102.6,512209.0,329204.0,,1548068208.99,80.1,1262516094.7,,,,,,
672,01/01/2003 12:00:00 AM,2003-01-01,2003,,,,11567192.0,417475159.0,273915080.0,682096.0,1196734.0,,,,,,,1778411.0,393287373.0,3492959.0,3334707.0,214932.0,2.0,,104.1,97.3,102.3,584452.0,363563.0,,1395876124.46,79.3,1177784627.07,,,,,,
673,02/01/2003 12:00:00 AM,2003-02-01,2003,,,,10905261.0,403320736.0,250536371.0,734517.0,1234433.0,,,,,,,1750527.0,390041481.0,3075308.0,3093034.0,197712.0,2.0,,103.6,95.8,101.4,540671.0,338432.0,,1366616979.16,79.1,1079560803.02,,,,,,
674,03/01/2003 12:00:00 AM,2003-03-01,2003,,,,12055551.0,450279167.0,288254216.0,927539.0,1571921.0,,,,,,,2067860.0,472573962.0,3449746.0,3334837.0,224115.0,2.0,,103.6,94.7,101.0,584957.0,368711.0,,1691870398.29,79.3,1233952636.56,,,,,,
675,04/01/2003 12:00:00 AM,2003-04-01,2003,,,,12207494.0,430320033.0,285233157.0,752724.0,1269661.0,,,,,,,2099917.0,483653074.0,3356762.0,3283200.0,197111.0,2.0,,103.9,92.0,100.4,572863.0,360439.0,,1524836689.03,79.6,1208202410.59,,,,,,
676,05/01/2003 12:00:00 AM,2003-05-01,2003,,,,12399397.0,430579038.0,285054648.0,948825.0,1587762.0,,,,,,,2148109.0,489484678.0,3526089.0,3406228.0,251527.0,2.0,,103.0,93.9,100.3,583294.0,363131.0,,1489449316.58,78.6,1243021283.97,,,,,,
677,06/01/2003 12:00:00 AM,2003-06-01,2003,,,,12396957.0,393401330.0,279688546.0,783113.0,1292847.0,,,,,,,2234326.0,531138943.0,3430092.0,3301869.0,226421.0,2.0,,102.8,94.5,100.4,569033.0,355396.0,,1473213693.61,78.8,1207784770.6,,,,,,
678,07/01/2003 12:00:00 AM,2003-07-01,2003,,,,13132151.0,407409768.0,285175975.0,745046.0,1202623.0,,,,,,,2339152.0,578767927.0,3521838.0,3377364.0,226461.0,2.0,,104.2,96.6,102.1,519619.0,329586.0,,1530099893.5,79.8,1263990903.99,,,,,,
679,08/01/2003 12:00:00 AM,2003-08-01,2003,,,,13007269.0,409536946.0,264511710.0,988407.0,1638736.0,,,,,,,2218201.0,557897322.0,3522479.0,3337370.0,231078.0,2.0,,103.8,97.1,102.0,528617.0,343744.0,,1501194158.97,79.0,1318439467.84,,,,,,
680,09/01/2003 12:00:00 AM,2003-09-01,2003,,,,12327882.0,415052233.0,288068664.0,791956.0,1311120.0,,,,,,,1950824.0,427807444.0,3340517.0,3266961.0,217091.0,2.0,,105.0,97.9,103.0,600016.0,345770.0,,1471921445.69,80.1,1276318486.6,,,,,,
681,10/01/2003 12:00:00 AM,2003-10-01,2003,,,,12707345.0,444745721.0,305712276.0,838667.0,1343195.0,,,,,,,2122801.0,463025617.0,3540731.0,3259559.0,245486.0,2.0,,106.7,97.5,104.0,609858.0,387698.0,,1644433897.63,81.5,1460484715.8,,,,,,
682,11/01/2003 12:00:00 AM,2003-11-01,2003,,,,11027276.0,378287944.0,272842877.0,1003027.0,1622614.0,,,,,,,2076766.0,448181812.0,3364895.0,3074287.0,222986.0,2.0,,106.2,98.7,104.1,541841.0,343070.0,,1669628700.82,81.2,1338769587.99,,,,,,
683,12/01/2003 12:00:00 AM,2003-12-01,2003,,,,11118676.0,400411587.0,285715811.0,746362.0,1241874.0,,,,,,,2142333.0,489403554.0,3473435.0,3154382.0,214798.0,2.0,,108.7,100.2,106.3,500516.0,338505.0,,1549080657.2200005,83.2,1424215600.93,,,,,,
684,01/01/2004 12:00:00 AM,2004-01-01,2004,,,,11018830.0,409337391.0,276051272.0,921814.0,1547242.0,,,,,,,1832125.0,410338393.0,3421239.0,3235764.0,215925.0,2.0,,107.8,99.8,105.6,517125.0,357073.0,,1384090324.49,82.1,1234820473.74,,,,,,
685,02/01/2004 12:00:00 AM,2004-02-01,2004,,,,11128329.0,410158046.0,273743955.0,777670.0,1272888.0,,,,,,,1839253.0,389778365.0,3203266.0,3101904.0,203595.0,2.0,,108.7,103.2,107.3,544406.0,354664.0,,1560915540.9299998,82.8,1264421878.2,,,,,,
686,03/01/2004 12:00:00 AM,2004-03-01,2004,,,,13083359.0,463135953.0,314407719.0,815199.0,1313555.0,,,,,,,2134151.0,452956930.0,3497464.0,3428953.0,221916.0,2.0,,110.3,102.4,108.1,628185.0,421153.0,,1852849723.39,85.0,1416580270.72,,,,,,
687,04/01/2004 12:00:00 AM,2004-04-01,2004,,,,12622794.0,433551893.0,300259204.0,831629.0,1323808.0,,,,,,,2191027.0,471114446.0,3361628.0,3232054.0,215451.0,2.0,,110.7,103.2,108.6,578979.0,385200.0,,1743325362.78,85.0,1343959445.61,,,,,,
688,05/01/2004 12:00:00 AM,2004-05-01,2004,,,,12504916.0,430379295.0,300918565.0,1064846.0,1677899.0,,,,,,,2218207.0,472861212.0,3420454.0,3344800.0,243135.0,2.0,,110.4,102.9,108.3,590540.0,376800.0,,1759024876.27,84.4,1324741910.12,,,,,,
689,06/01/2004 12:00:00 AM,2004-06-01,2004,,,,13075987.0,411782839.0,309207234.0,845719.0,1310774.0,,,,,,,2221743.0,514365919.0,3356346.0,3451479.0,226918.0,2.0,,111.0,104.2,109.2,621375.0,388085.0,,1750233211.6999998,85.5,1330791002.2499998,,,,,,
690,07/01/2004 12:00:00 AM,2004-07-01,2004,,,,13176149.0,403861950.0,297240421.0,1055598.0,1594359.0,,,,,,,2291328.0,554813029.0,3500527.0,3359455.0,232771.0,2.0,,111.2,104.2,109.3,548029.0,366672.0,,1828606943.33,85.3,1359617810.2499998,,,,,,
691,08/01/2004 12:00:00 AM,2004-08-01,2004,,,,13475827.0,418027214.0,296587040.0,876056.0,1333886.0,,,,,,,2220921.0,511216651.0,3506284.0,3446259.0,237951.0,2.0,,110.1,104.3,108.6,609725.0,375893.0,,1781455880.81,84.6,1331532716.55,,,,,,
692,09/01/2004 12:00:00 AM,2004-09-01,2004,,,,12450132.0,439273086.0,295529063.0,868336.0,1314238.0,,,,,,,1938327.0,401403280.0,3283544.0,3266465.0,224226.0,2.0,,110.7,104.3,109.0,602098.0,369295.0,,1852678025.28,84.9,1393406684.61,,,,,,
693,10/01/2004 12:00:00 AM,2004-10-01,2004,,,,12654418.0,456979338.0,309773343.0,1157349.0,1700046.0,,,,,,,2115874.0,436908280.0,3521681.0,3320355.0,249119.0,2.0,,111.4,106.2,110.1,585682.0,376217.0,,1989881545.47,84.5,1527977947.88,,,,,,
694,11/01/2004 12:00:00 AM,2004-11-01,2004,,,,11847759.0,428941252.0,298380015.0,889978.0,1310672.0,,,,,,,2157451.0,440222335.0,3354450.0,3201482.0,214741.0,2.0,,112.2,105.4,110.3,575623.0,376671.0,,2040340223.53,85.5,1397972935.51,,,,,,
695,12/01/2004 12:00:00 AM,2004-12-01,2004,,,,11717965.0,429622039.0,298029360.0,865036.0,1278161.0,,,,,,,2230181.0,476798294.0,3448991.0,3137694.0,221641.0,2.0,,111.7,106.4,110.4,502115.0,355965.0,,1958533678.31,84.9,1526983769.34,,,,,,
696,01/01/2005 12:00:00 AM,2005-01-01,2005,,,,11611875.0,416054551.0,311945546.0,1004042.0,1538344.0,,,,,,7784000.0,1839989.0,378368103.0,3339582.0,3203078.0,226426.0,2.0,,114.1,107.7,112.4,534785.0,361479.0,,1696943758.9099998,88.3,1280515593.56,,,,,,
697,02/01/2005 12:00:00 AM,2005-02-01,2005,,,,11445295.0,403144202.0,305374953.0,885038.0,1340764.0,,,,,,7980000.0,1794687.0,351583660.0,3068580.0,2984504.0,210886.0,2.0,,113.2,108.0,111.9,528576.0,366633.0,,1561958529.8600004,86.4,1253130189.92,,,,,,
698,03/01/2005 12:00:00 AM,2005-03-01,2005,,,,13310572.0,473893673.0,349880600.0,846425.0,1344164.0,,,,,,7737000.0,2259679.0,463828081.0,3441123.0,3364647.0,252975.0,2.0,,112.4,108.2,111.3,591197.0,397724.0,,1958161775.53,85.6,1469764699.28,,,,,,
699,04/01/2005 12:00:00 AM,2005-04-01,2005,,,,12907373.0,443809746.0,335620384.0,1095545.0,1704628.0,,,,,,7672000.0,2118528.0,430496434.0,3253238.0,3217894.0,221997.0,2.0,,113.1,108.6,112.0,561750.0,395480.0,,2078221975.9,86.6,1226824174.27,,,,,,
700,05/01/2005 12:00:00 AM,2005-05-01,2005,,,,12763833.0,455794647.0,342804244.0,893384.0,1332755.0,,,,,,7651000.0,2197000.0,462014277.0,3334596.0,3263367.0,227972.0,2.0,,112.4,108.8,111.6,596880.0,396384.0,,1925489196.69,85.8,1261164593.01,,,,,,
701,06/01/2005 12:00:00 AM,2005-06-01,2005,,,,13209072.0,425623606.0,347032914.0,872857.0,1307469.0,,,,,,7524000.0,2229181.0,508598324.0,3266316.0,3251803.0,232483.0,2.0,,111.8,108.8,111.2,599366.0,402530.0,,1981247254.09,85.7,1351713954.53,,,,,,
702,07/01/2005 12:00:00 AM,2005-07-01,2005,,,,13521836.0,424058723.0,327366213.0,1112897.0,1596811.0,,,,,,7406000.0,2294045.0,548229054.0,3335575.0,3219043.0,230117.0,2.0,,111.8,109.0,111.3,505642.0,361828.0,,1896306910.37,85.4,1325121254.21,,,,,,
703,08/01/2005 12:00:00 AM,2005-08-01,2005,,,,14296142.0,442130056.0,340440029.0,939277.0,1339598.0,,,,,,7345000.0,2240237.0,511556316.0,3406844.0,3451799.0,258759.0,2.0,,112.7,108.1,111.5,619513.0,407199.0,,2004977072.62,86.9,1266498960.87,,,,,,
704,09/01/2005 12:00:00 AM,2005-09-01,2005,,,,13164273.0,463465350.0,338889664.0,926052.0,1343257.0,,,,,,7553000.0,2098159.0,436175168.0,3243126.0,3157384.0,216173.0,2.0,,111.7,110.4,111.5,580446.0,390992.0,,2037929110.39,86.5,1274319928.19,,,,,,
705,10/01/2005 12:00:00 AM,2005-10-01,2005,,,,12724915.0,475619140.0,352622258.0,1234429.0,1661907.0,,,,,,7453000.0,2122908.0,432503304.0,3378017.0,3192168.0,227293.0,2.0,,111.2,107.6,110.4,593744.0,406766.0,,2195277300.28,86.1,1309094741.92,,,,,,
706,11/01/2005 12:00:00 AM,2005-11-01,2005,,,,12004340.0,438362844.0,344979889.0,931054.0,1298401.0,,,,,,7566000.0,2076932.0,435866215.0,3250466.0,3097953.0,218347.0,2.0,,113.9,109.3,112.8,570492.0,409006.0,,2171935188.9,88.6,1322616874.28,,,,,,
707,12/01/2005 12:00:00 AM,2005-12-01,2005,,,,11726417.0,411892658.0,316587280.0,1117023.0,1566013.0,,,,,,7279000.0,2005417.0,447261670.0,3276882.0,3015519.0,223255.0,2.0,,112.5,108.9,111.7,501553.0,381580.0,,2052950127.89,86.4,1405020466.1,,,,,,
708,01/01/2006 12:00:00 AM,2006-01-01,2006,,,,12505513.0,438299910.0,330539232.0,892580.0,1318201.0,,,,,,7064000.0,1719180.0,363830405.0,3283391.0,3127357.0,228549.0,2.0,,112.6,110.2,112.1,551284.0,392139.0,,1767954759.7800002,86.4,1153227922.86,,,,69366670434.0,25889852756.0,43476817678.0
709,02/01/2006 12:00:00 AM,2006-02-01,2006,,,,11848949.0,412222617.0,309249282.0,901993.0,1314180.0,,,,,,7184000.0,1691007.0,347575222.0,2965680.0,2901638.0,212394.0,2.0,,111.6,110.5,111.5,524623.0,381670.0,,1669369405.39,85.5,1090956898.99,,,,67380212450.0,24889246186.0,42490966264.00001
710,03/01/2006 12:00:00 AM,2006-03-01,2006,,,,13735168.0,483558319.0,360285296.0,905136.0,1343595.0,,,,,,7072000.0,2035593.0,430329187.0,3371943.0,3308004.0,261878.0,2.0,,112.0,110.7,111.9,600750.0,428671.0,,2224075949.06,85.0,1393292715.48,,,,77057154285.0,29352917211.0,47704237074.0
711,04/01/2006 12:00:00 AM,2006-04-01,2006,,,,12818348.0,425703184.0,333203331.0,1182971.0,1691526.0,,,,,,7120000.0,2072708.0,445609435.0,3209644.0,3043590.0,224080.0,2.0,,111.4,111.1,111.6,546766.0,385711.0,,2009951303.78,84.9,1260968515.34,,,,70838372200.0,26444278921.0,44394093279.0
712,05/01/2006 12:00:00 AM,2006-05-01,2006,,,,14180112.0,457520661.0,363777923.0,960587.0,1386049.0,,,,,,6980000.0,2137806.0,459957974.0,3347504.0,3260833.0,224747.0,2.0,,113.7,111.5,113.3,605389.0,421037.0,,1948254139.55,87.3,1262064520.38,,,,75632852437.0,28697460741.0,46935391696.0
713,06/01/2006 12:00:00 AM,2006-06-01,2006,,,,14057602.0,448795706.0,361876423.0,944639.0,1354652.0,,,,,,7001000.0,2237119.0,516527472.0,3289283.0,3199531.0,230334.0,2.0,,113.2,110.9,112.8,582843.0,417233.0,,2045345991.33,86.3,1322621839.98,,,,76422757645.0,29489267721.0,46933489924.0
714,07/01/2006 12:00:00 AM,2006-07-01,2006,,,,13903911.0,416933462.0,338056818.0,1180013.0,1628167.0,,,,,,7175000.0,2259429.0,549393934.0,3354056.0,3140454.0,229935.0,2.0,,112.0,110.9,111.9,509647.0,384092.0,,1991845390.05,85.4,1209683130.28,,,,65134807975.99999,25893417390.0,39241390586.0
715,08/01/2006 12:00:00 AM,2006-08-01,2006,,,,14898006.0,445540060.0,357020265.0,994485.0,1350527.0,,,,,,7091000.0,2248256.0,530942270.0,3399512.0,3321303.0,238033.0,2.0,,109.7,109.5,109.8,594103.0,423336.0,,2037074956.94,82.7,1358627379.55,,,,76333253659.0,29707684511.0,46625569148.0
716,09/01/2006 12:00:00 AM,2006-09-01,2006,,,,13428739.0,459431946.0,356780246.0,1241071.0,1691623.0,,,,,,6847000.0,1955830.0,427768908.0,3294187.0,3151792.0,253382.0,2.0,,113.0,110.9,112.6,542189.0,383450.0,,2094828907.99,85.4,1292726751.98,,,,72079752821.0,27887000687.0,44192752134.0
717,10/01/2006 12:00:00 AM,2006-10-01,2006,,,,13754109.0,485015462.0,363172974.0,1006812.0,1349556.0,,,,,,6727000.0,2142741.0,451598087.0,3387829.0,3218233.0,232370.0,2.0,,110.9,111.7,111.4,576799.0,415454.0,,2205705333.28,84.7,1309027734.17,,,,75447444167.0,30012311263.0,45435132903.99999
718,11/01/2006 12:00:00 AM,2006-11-01,2006,,,,12680862.0,437717915.0,360062057.0,942195.0,1284008.0,,,,,,6872000.0,2154746.0,451610146.0,3366870.0,3084829.0,224714.0,2.0,,108.6,113.0,110.2,544329.0,370937.0,,2273447644.05,82.3,1332611026.27,,,,73379284049.0,28999919819.0,44379364230.0
719,12/01/2006 12:00:00 AM,2006-12-01,2006,,,,12345070.0,425963560.0,339286556.0,1129739.0,1595477.0,,,,,,6762000.0,2070530.0,461370074.0,3423096.0,2977391.0,233642.0,2.0,,110.7,113.7,111.8,470527.0,356786.0,,2129329891.53,84.2,1376716744.27,,,,67026206350.0,25162365025.0,41863841325.0
720,01/01/2007 12:00:00 AM,2007-01-01,2007,,,,13003793.0,433319139.0,347045319.0,879500.0,1230738.0,,,,,,7116000.0,1797833.0,377529725.0,3458828.0,3184044.0,230387.0,2.0,,109.9,113.9,111.4,536693.0,390428.0,,1849783423.74,83.8,1176577164.26,,,,68304959260.0,26072386551.0,42232572709.0
721,02/01/2007 12:00:00 AM,2007-02-01,2007,,,,12300052.0,410425497.0,322952249.0,913771.0,1251534.0,,,,,,6927000.0,1780001.0,360542790.0,3089233.0,2878284.0,218986.0,2.0,,110.5,113.8,111.7,514972.0,378824.0,,1794748245.22,84.1,1114175419.19,,,,66506307521.0,25193366749.0,41312940772.0
722,03/01/2007 12:00:00 AM,2007-03-01,2007,,,,14051553.0,470885217.0,376082865.0,1145768.0,1627289.0,,,,,,6731000.0,2175847.0,459164806.0,3489454.0,3325001.0,262524.0,2.0,,111.9,116.4,113.5,587330.0,437841.0,,2262186553.6400003,85.4,1328374154.7500002,,,,78910075380.0,29858393125.0,49051682255.0
723,04/01/2007 12:00:00 AM,2007-04-01,2007,,,,13577513.0,438259495.0,358294250.0,908139.0,1320026.0,,,,,,6850000.0,2208166.0,470429231.0,3363170.0,3130029.0,227985.0,2.0,,110.3,115.9,112.2,552580.0,400621.0,,2060972050.65,83.7,1195997821.33,,,,73408296384.0,27192130995.0,46216165389.0
724,05/01/2007 12:00:00 AM,2007-05-01,2007,,,,14758045.0,465355047.0,388136492.0,938125.0,1312506.0,,,,,,6766000.0,2314375.0,494257576.0,3505786.0,3301459.0,229260.0,2.0,,110.4,119.0,113.2,592961.0,439258.0,,2006753515.14,83.8,1276607909.91,,,,78746260454.0,29980270491.0,48765989963.0
725,06/01/2007 12:00:00 AM,2007-06-01,2007,,,,14361038.0,435333936.0,363690648.0,1167072.0,1657630.0,,,,,,6979000.0,2327930.0,545207971.0,3399084.0,3188923.0,231943.0,2.0,,109.7,116.7,112.1,551073.0,414625.0,,2017137962.6,82.8,1265465326.71,,,,79107533580.0,29619274794.0,49488258786.0
726,07/01/2007 12:00:00 AM,2007-07-01,2007,,,,15098531.0,419634355.0,362257868.0,913590.0,1246644.0,,,,,,7149000.0,2459575.0,585837053.0,3519559.0,3210346.0,232776.0,2.0,,108.8,116.4,111.3,510805.0,399854.0,,2022348251.22,82.8,1215467635.7,,,,71238491653.0,27991571795.0,43246919858.0
727,08/01/2007 12:00:00 AM,2007-08-01,2007,,,,16005421.0,452087647.0,371512052.0,951346.0,1337299.0,,,,,,7067000.0,2468308.0,570807078.0,3536676.0,3347717.0,235076.0,2.0,,109.6,117.4,112.2,555071.0,432633.0,,2033181108.08,83.6,1340746718.77,,,,79109694815.0,31551252659.0,47558442156.0
728,09/01/2007 12:00:00 AM,2007-09-01,2007,,,,14101814.0,455286432.0,357188270.0,1207322.0,1676379.0,,,,,,7170000.0,2118244.0,451772968.0,3369792.0,3052935.0,228121.0,2.0,,109.4,117.7,112.1,531706.0,381680.0,,2034109815.4500003,82.5,1287370145.29,,,,76263887783.0,28954564146.0,47309323637.0
729,10/01/2007 12:00:00 AM,2007-10-01,2007,,,,15176191.0,490281303.0,401551621.0,968767.0,1343346.0,,,,,,7237000.0,2340628.0,483184463.0,3508841.0,3334727.0,232370.0,2.0,,110.9,116.5,112.8,582390.0,435214.0,,2227125458.89,84.6,1333694288.93,,,,84334046978.0,32176632422.0,52157414556.0
730,11/01/2007 12:00:00 AM,2007-11-01,2007,,,,13788556.0,454062969.0,367685978.0,921692.0,1306448.0,,,,,,7240000.0,2414398.0,503151672.0,3400870.0,3039860.0,224714.0,2.0,,110.7,117.3,112.9,527722.0,411913.0,,2269034764.15,84.5,1291889279.36,,,,81750659564.0,31775958396.000004,49974701168.0
731,12/01/2007 12:00:00 AM,2007-12-01,2007,,,,12962246.0,408262635.0,347607458.0,1111539.0,1578639.0,,,,,,7645000.0,2313336.0,508739922.0,3418348.0,2895404.0,230091.0,2.0,,110.8,116.5,112.7,434458.0,359609.0,,2142713001.28,84.6,1316155430.42,,,,71208112206.0,26974480564.0,44233631642.0
732,01/01/2008 12:00:00 AM,2008-01-01,2008,,,,13911623.0,442844351.0,348756976.0,842973.0,1238122.0,,,,,,7685000.0,2005292.0,416211470.0,3417775.0,3221099.0,194991.0,2.0,,113.4,116.7,114.7,512845.0,412007.0,,1897167409.87,87.5,1168017692.7,,,,75581311714.0,28897924914.0,46683386800.0
733,02/01/2008 12:00:00 AM,2008-02-01,2008,,,,13552083.0,436354219.0,350565609.0,895787.0,1275732.0,,,,,,7497000.0,2029844.0,395912010.0,3257992.0,3035762.0,235165.0,2.0,,111.5,118.4,113.8,494703.0,410154.0,,1835050526.36,85.9,1102383603.59,,,,78792976709.0,29937303686.0,48855673023.0
734,03/01/2008 12:00:00 AM,2008-03-01,2008,,,,14503295.0,459855512.0,373608282.0,1080335.0,1638976.0,,,,,,7822000.0,2426487.0,504552405.0,3473707.0,3175595.0,229366.0,2.0,,109.8,116.9,112.1,507685.0,407802.0,,2166417618.7200003,85.8,1199357350.76,,,,81560060553.0,29409357572.0,52150702981.0
735,04/01/2008 12:00:00 AM,2008-04-01,2008,,,,15120273.0,472743286.0,387548619.0,892452.0,1326924.0,,,,,,7637000.0,2320765.0,473811702.0,3392761.0,3265196.0,222564.0,2.0,,111.6,116.9,113.5,530006.0,445437.0,,2184519615.5,86.6,1230238960.65,,,,86359515720.0,31907991127.0,54451524593.0
736,05/01/2008 12:00:00 AM,2008-05-01,2008,,,,15364239.0,475240402.0,390906198.0,1126439.0,1642365.0,,,,,,8395000.0,2593835.0,550928592.0,3497372.0,3258385.0,230300.0,2.0,,111.5,117.3,113.5,516173.0,434920.0,,2027888271.42,86.4,1215188828.96,,,,85522656258.99998,31122197554.0,54400458705.0
737,06/01/2008 12:00:00 AM,2008-06-01,2008,,,,15195299.0,454355659.0,379646114.0,923031.0,1291373.0,,,,,,8575000.0,2598974.0,580290736.0,3430792.0,3241677.0,229177.0,2.0,,110.0,116.4,112.1,518059.0,425939.0,,1977585958.39,86.9,1126079889.35,,,,87054164449.0,32385228333.0,54668936116.0
738,07/01/2008 12:00:00 AM,2008-07-01,2008,,,,16530125.0,465258074.0,394473975.0,894970.0,1264217.0,,,,,,8937000.0,2796007.0,645144911.0,3531821.0,3310377.0,233653.0,2.0,,111.1,116.3,112.9,493902.0,421204.0,,1924038668.25,86.3,1176962349.24,,,,86076374725.0,33060251934.0,53016122791.0
739,08/01/2008 12:00:00 AM,2008-08-01,2008,,,,15988931.0,459672005.0,381055732.0,1172325.0,1670259.0,,,,,,9438000.0,2756141.0,620188551.0,3518955.0,3314557.0,260328.0,2.0,,109.1,115.5,111.3,486457.0,408367.0,,1896372062.76,84.4,1147282064.78,,,,85126736898.0,33334535658.0,51792201240.00001
740,09/01/2008 12:00:00 AM,2008-09-01,2008,,,,15598345.0,488997144.0,373447640.0,918319.0,1273960.0,,,,,,9494000.0,2322511.0,500634771.0,3348813.0,3201517.0,221348.0,2.0,,107.5,112.2,109.2,511697.0,394948.0,,1873575463.94,84.4,1100378316.16,,,,83115558338.0,31020176797.0,52095381541.0
741,10/01/2008 12:00:00 AM,2008-10-01,2008,,,,16493417.0,515540107.0,404082236.0,946084.0,1315594.0,,,,,,10074000.0,2442790.0,517898247.0,3511001.0,3374326.0,234170.0,2.0,,107.5,112.6,109.3,503870.0,423168.0,,1959160995.08,82.9,1182951141.16,,,,84499297804.0,34515941934.0,49983355870.0
742,11/01/2008 12:00:00 AM,2008-11-01,2008,,,,13826498.0,441442550.0,363247932.0,1080932.0,1504363.0,,,,,,10538000.0,2326111.0,484492078.0,3387137.0,2957053.0,218665.0,2.0,,104.3,110.7,106.5,436177.0,351074.0,,1773000430.69,81.6,1018287121.94,,,,69213078849.0,27446022062.0,41767056787.0
743,12/01/2008 12:00:00 AM,2008-12-01,2008,,,,13923348.0,428951169.0,375802709.0,743593.0,1065009.0,,,,,,11286000.0,2285949.0,511270950.0,3483401.0,3067198.0,230017.0,2.0,,100.4,110.3,103.6,382977.0,331232.0,,1550112466.3200002,79.4,1079636931.77,,,,61021347861.0,24416514701.0,36604833160.0
744,01/01/2009 12:00:00 AM,2009-01-01,2009,,,,14517434.0,430468511.0,347843528.0,930248.0,1294266.0,,,,,,12058000.0,1978924.0,419766348.0,4108554.0,3243862.0,247170.0,2.0,,98.6,109.7,102.1,385057.0,338857.0,,1324523612.66,77.5,933106571.95,,,,54264520205.0,22255716686.0,32008803519.0
745,02/01/2009 12:00:00 AM,2009-02-01,2009,,,,14387413.0,427594360.0,333974553.0,726343.0,1105996.0,,,,,,12898000.0,1850090.0,376710497.0,3181921.0,2924185.0,212344.0,2.0,,101.0,110.7,104.1,384478.0,328561.0,,1330540458.68,79.4,860230144.67,,,,54670993975.0,21648711219.0,33022282756.0
746,03/01/2009 12:00:00 AM,2009-03-01,2009,,,,15974192.0,468329044.0,378966895.0,729033.0,1081908.0,,,,,,13426000.0,2182251.0,456227991.0,3516742.0,3306315.0,231057.0,2.0,,95.9,108.7,99.8,422741.0,363836.0,,1564439209.8600004,75.7,929344434.46,,,,58379262913.0,23950015588.0,34429247325.0
747,04/01/2009 12:00:00 AM,2009-04-01,2009,,,,16240265.0,454702768.0,377470995.0,730778.0,1025839.0,,,,,,13853000.0,2271283.0,469783200.0,3423245.0,3257856.0,223868.0,2.0,,94.9,110.6,99.7,404950.0,357907.0,,1528383403.65,74.8,946335257.99,,,,56759014671.0,23277249208.0,33481765463.0
748,05/01/2009 12:00:00 AM,2009-05-01,2009,,,,15570587.0,444291111.0,370529931.0,917799.0,1250145.0,,,,,,14499000.0,2344393.0,494908098.0,4136079.0,3244322.0,227822.0,2.0,,95.1,108.0,99.1,396308.0,341601.0,,1471200408.32,76.4,956170884.14,,,,55523157941.0,22737433984.0,32785723957.0
749,06/01/2009 12:00:00 AM,2009-06-01,2009,,,,16325621.0,431182492.0,376856227.0,755000.0,1038845.0,,,,,,14707000.0,2378540.0,542873119.0,3468903.0,3371421.0,229614.0,2.0,,96.2,108.6,100.1,418105.0,360817.0,,1652118062.33,75.3,961191331.76,,,,59674562453.0,24564745752.0,35109816701.0
750,07/01/2009 12:00:00 AM,2009-07-01,2009,,,,17076574.0,431446591.0,372524894.0,729050.0,1044887.0,,,,,,14601000.0,2557381.0,596670353.0,3620025.0,3518664.0,260880.0,2.0,,98.4,109.8,102.0,412855.0,362086.0,,1608275390.18,76.9,1009787804.04,,,,60146780364.0,25235656069.0,34911124295.0
751,08/01/2009 12:00:00 AM,2009-08-01,2009,,,,16611311.0,428646266.0,366264820.0,977946.0,1390155.0,,,,,,14814000.0,2520906.0,582302101.0,3571055.0,3360872.0,237125.0,2.0,,99.3,109.6,102.5,435764.0,352340.0,,1627588250.85,78.0,984831399.38,,,,62923115733.0,26094670335.0,36828445398.0
752,09/01/2009 12:00:00 AM,2009-09-01,2009,,,,15992063.0,458278407.0,372588507.0,786714.0,1104050.0,,,,,,15009000.0,2179662.0,462787005.0,3436159.0,3340667.0,220257.0,2.0,,99.8,109.5,102.8,455815.0,364722.0,,1710865555.2,78.4,1036690545.26,,,,66112775998.0,27740902641.0,38371873357.0
753,10/01/2009 12:00:00 AM,2009-10-01,2009,,,,16181489.0,477088524.0,391675506.0,1032634.0,1378221.0,,,,,,15352000.0,2379080.0,493132875.0,3576429.0,3474911.0,232245.0,2.0,,98.8,109.8,102.2,459183.0,393942.0,,1916120078.45,77.9,1129581753.25,,,,70336899735.0,30029839835.0,40307059900.0
754,11/01/2009 12:00:00 AM,2009-11-01,2009,,,,14546719.0,429186120.0,342813909.0,794184.0,1088480.0,,,,,,15219000.0,2390149.0,498855768.0,3445180.0,3191214.0,219605.0,2.0,,101.3,109.3,103.8,441097.0,366670.0,,2000844045.44,79.3,1052014021.99,,,,67860111442.0,29167249763.0,38692861679.0
755,12/01/2009 12:00:00 AM,2009-12-01,2009,,,,14853920.0,412880829.0,361544943.0,763650.0,1014468.0,,,,,,15098000.0,2395277.0,537980573.0,3529260.0,3264600.0,226685.0,2.0,,101.8,110.4,104.5,404280.0,360126.0,,1899799359.45,80.1,1228033419.8,,,,68461194879.0,28823099341.0,39638095538.0
756,01/01/2010 12:00:00 AM,2010-01-01,2010,,,,14499667.0,410457520.0,347691757.0,952420.0,1283950.0,,,,,,15046000.0,2032892.0,440854078.0,3521094.0,3377882.0,225554.0,2.0,,103.2,110.5,105.5,415459.0,362361.0,,1651272851.77,80.5,977334970.33,,,,66504177031.99999,27611667467.0,38892509565.0
757,02/01/2010 12:00:00 AM,2010-02-01,2010,,,,13892250.0,399337177.0,316986967.0,799592.0,1089342.0,,,,,,15113000.0,1951901.0,405905875.0,3088012.0,3122066.0,192744.0,2.0,,105.3,108.4,106.2,417651.0,365684.0,,1638814937.27,81.3,926043101.46,,,,67952720432.0,28174483135.0,39778237297.0
758,03/01/2010 12:00:00 AM,2010-03-01,2010,,,,16722930.0,469307244.0,391219357.0,828178.0,1155070.0,,,,,,15202000.0,2474908.0,538675366.0,3560237.0,3629837.0,212974.0,2.0,,105.6,110.8,107.2,492826.0,437589.0,,1971931104.8,81.9,1085023426.05,,,,80796334351.0,34290828038.0,46505506313.0
759,04/01/2010 12:00:00 AM,2010-04-01,2010,,,,16387381.0,449671571.0,387345724.0,821999.0,1173210.0,,,,,,15325000.0,2446113.0,520013629.0,3451608.0,3478591.0,205893.0,2.0,,106.5,110.5,107.7,460846.0,406696.0,,1913703530.76,82.1,1076584531.88,,,,76470082127.99998,31842911421.0,44627170707.0
760,05/01/2010 12:00:00 AM,2010-05-01,2010,,,,15944034.0,435053879.0,385478717.0,1080537.0,1448691.0,,,,,,14849000.0,2503651.0,544408276.0,3518013.0,3451013.0,209347.0,2.0,,106.4,111.3,107.9,469528.0,406353.0,,2062540998.98,81.6,1061357921.46,,,,77727941124.0,32698495724.000004,45029445400.00001
761,06/01/2010 12:00:00 AM,2010-06-01,2010,,,,16650219.0,428191164.0,380981068.0,870031.0,1130224.0,,,,,,14474000.0,2593688.0,604206171.0,3494704.0,3539687.0,219803.0,2.0,,106.6,111.9,108.2,492507.0,416531.0,,2004492807.29,81.6,1079168511.92,,,,80909697216.0,33940858396.000004,46968838820.0
762,07/01/2010 12:00:00 AM,2010-07-01,2010,,,,16716659.0,411698466.0,373528956.0,1115254.0,1407843.0,,,,,,14512000.0,2805798.0,669880427.0,3616853.0,3527738.0,244242.0,2.0,,107.0,111.9,108.5,434100.0,385688.0,,1994088224.8600004,81.9,1075826165.3,,,,72367667069.0,31424152375.0,40943514694.0
763,08/01/2010 12:00:00 AM,2010-08-01,2010,,,,17451396.0,427127276.0,383073592.0,938573.0,1179946.0,,,,,,14648000.0,2574165.0,597056638.0,3616066.0,3561651.0,218240.0,2.0,,106.9,112.3,108.6,480133.0,405326.0,,1998647752.59,81.4,1057511902.43,,,,79100972156.0,34429801868.0,44671170288.0
764,09/01/2010 12:00:00 AM,2010-09-01,2010,,,,16396144.0,450528523.0,381010089.0,925036.0,1188626.0,,,,,,14579000.0,2300632.0,497091526.0,3470407.0,3456769.0,213064.0,2.0,,107.2,113.0,109.0,468864.0,386817.0,,2012279979.38,82.1,1074590404.68,,,,78737398373.0,33861404694.0,44875993679.0
765,10/01/2010 12:00:00 AM,2010-10-01,2010,,,,16297987.0,461866467.0,393517665.0,1182027.0,1495018.0,,,,,,14516000.0,2542494.0,531024449.0,3579201.0,3523077.0,220455.0,2.0,,108.0,114.8,110.1,460799.0,397002.0,,2283637476.54,83.1,1031729639.53,,,,81579134764.0,35929532093.0,45649602671.0
766,11/01/2010 12:00:00 AM,2010-11-01,2010,,,,15225173.0,434670973.0,371234187.0,883755.0,1138512.0,,,,,,15081000.0,2541469.0,528519429.0,3465170.0,3334575.0,218258.0,2.0,,107.5,113.9,109.5,449269.0,396321.0,,2265592625.69,82.9,972441642.74,,,,79456451266.99998,35445989804.0,44010461463.0
767,12/01/2010 12:00:00 AM,2010-12-01,2010,,,,15110462.0,403340128.0,378015824.0,867206.0,1118655.0,,,,,,14348000.0,2505001.0,558069744.0,3569982.0,3376318.0,232294.0,2.0,,108.8,113.2,110.2,402423.0,376557.0,,2178357285.77,84.0,1122729492.98,,,,78940703849.0,33999962467.0,44940741382.0
768,01/01/2011 12:00:00 AM,2011-01-01,2011,,,,14725448.0,408972557.0,353341329.0,1030003.0,1384330.0,,,,,,14013000.0,2126847.0,456336772.0,3528530.0,3429673.0,203435.0,2.0,,110.1,113.4,111.1,440684.0,390067.0,,1948186626.06,85.3,923950123.31,,,,79900550011.0,34456731905.0,45443818106.0
769,02/01/2011 12:00:00 AM,2011-02-01,2011,,,,14252551.0,404031114.0,345816403.0,881817.0,1136916.0,,,,,,13820000.0,2099631.0,436196722.0,3191996.0,3152260.0,197663.0,2.0,,109.5,112.6,110.4,419227.0,375579.0,,1809103168.84,84.6,853268228.57,,,,76691534587.0,32962292149.0,43729242438.0
770,03/01/2011 12:00:00 AM,2011-03-01,2011,,,,17218800.0,470021909.0,403661890.0,876993.0,1187648.0,,,,,,13737000.0,2612362.0,566357389.0,3588882.0,3619644.0,214425.0,2.0,,111.1,113.6,111.8,503747.0,450390.0,,2355563756.05,86.9,1054733909.39,,,,94611538935.0,40607414832.0,54004124103.0
771,04/01/2011 12:00:00 AM,2011-04-01,2011,,,,16620349.0,443442345.0,380098875.0,1148826.0,1483182.0,,,,,,13957000.0,2689904.0,572508869.0,3449722.0,3365734.0,208030.0,2.0,,110.5,113.9,111.5,450476.0,406786.0,,2151137876.72,86.1,1027909171.84,,,,87197479554.99998,37392314782.0,49805164773.0
772,05/01/2011 12:00:00 AM,2011-05-01,2011,,,,16932014.0,443812793.0,403264476.0,932956.0,1159421.0,,,,,,13855000.0,2707136.0,584806522.0,3575208.0,3501895.0,214988.0,2.0,,108.7,114.9,110.6,481860.0,427866.0,,2087729636.2000003,84.8,994575693.13,,,,91226955751.0,39781982135.0,51444973616.0
773,06/01/2011 12:00:00 AM,2011-06-01,2011,,,,17458827.0,432593481.0,394758396.0,915444.0,1142637.0,,,,,,13962000.0,2844286.0,595163810.0,3485629.0,3516530.0,210329.0,2.0,,110.3,114.3,111.5,486042.0,428731.0,,2030696077.12,86.4,1049326409.23,,,,90662845586.0,39507602976.0,51155242610.0
774,07/01/2011 12:00:00 AM,2011-07-01,2011,,,,17187395.0,407435042.0,383886673.0,1132637.0,1397625.0,,,,,,13763000.0,2931813.0,632786423.0,3595073.0,3458617.0,239646.0,2.0,,110.4,115.2,111.9,427166.0,389195.0,,2073639897.42,85.7,985666413.76,,,,84833266035.0,37136662580.0,47696603455.0
775,08/01/2011 12:00:00 AM,2011-08-01,2011,,,,18111246.0,436180377.0,372048497.0,945897.0,1180210.0,,,,,,13818000.0,2754574.0,581116991.0,3476455.0,3603128.0,218846.0,2.0,,110.7,112.1,111.1,463168.0,395587.0,,2039677692.71,86.6,1023595246.86,,,,93047245960.0,40916742353.0,52130503607.0
776,09/01/2011 12:00:00 AM,2011-09-01,2011,,,,16961593.0,461288470.0,396967860.0,932683.0,1186689.0,,,,,,13948000.0,2537282.0,509094731.0,3448614.0,3435574.0,216987.0,2.0,,111.4,114.9,112.4,467016.0,399902.0,,2006847394.45,87.3,1006904700.71,,,,90592844279.0,39398844079.0,51194000199.99999
777,10/01/2011 12:00:00 AM,2011-10-01,2011,,,,16699635.0,471099250.0,415259570.0,1226430.0,1527797.0,,,,,,13594000.0,2390414.0,543403112.0,3572176.0,3489930.0,222123.0,2.0,,111.5,115.3,112.7,472396.0,412429.0,,2145457626.74,87.5,1028994819.89,,,,91746939287.0,40486720358.0,51260218929.0
778,11/01/2011 12:00:00 AM,2011-11-01,2011,,,,15752351.0,441713618.0,389176595.0,918252.0,1165279.0,,,,,,13302000.0,2631848.0,552477847.0,3436879.0,3338743.0,212351.0,2.0,,112.0,115.2,112.9,464071.0,409868.0,,2111253526.99,88.2,1029775545.05,,,,90287414693.0,40811032145.0,49476382548.0
779,12/01/2011 12:00:00 AM,2011-12-01,2011,,,,15624820.0,422212928.0,385444895.0,1117387.0,1445936.0,,,,,,13093000.0,2516685.0,557374424.0,3554044.0,3205844.0,242939.0,2.0,,114.9,115.9,115.1,414522.0,381976.0,,2106280050.44,91.6,1155033100.51,,,,86980002670.0,37703992942.0,49276009728.0
780,01/01/2012 12:00:00 AM,2012-01-01,2012,,,,15315315.0,427953710.0,378393816.0,877734.0,1145345.0,,,,,,12797000.0,2224842.0,463005361.0,3562085.0,3340880.0,210871.0,2.0,,111.5,115.5,112.7,452501.0,415573.0,,1754199367.55,87.7,914974304.19,,,,87382525730.99998,38516958766.0,48865566965.0
781,02/01/2012 12:00:00 AM,2012-02-01,2012,,,,15679367.0,439194906.0,383436669.0,895205.0,1127730.0,,,,,,12813000.0,2232285.0,461139329.0,3309668.0,3201458.0,201495.0,2.0,,112.0,117.7,113.8,451118.0,417237.0,,1855039236.63,88.8,954472518.7,,,,89293963402.0,39553499088.0,49740464314.0
782,03/01/2012 12:00:00 AM,2012-03-01,2012,,,,16912364.0,466571084.0,408269094.0,1155584.0,1406529.0,,,,,,12713000.0,2766401.0,544100123.0,3518787.0,3483259.0,209556.0,2.0,,111.8,116.0,113.1,485415.0,458966.0,,2221366108.96,89.2,1086087112.39,,,,99725808644.0,44122368388.0,55603440256.0
783,04/01/2012 12:00:00 AM,2012-04-01,2012,,,,16699638.0,441914254.0,389407693.0,946966.0,1113362.0,,,,,,12646000.0,2765051.0,585609840.0,3441450.0,3309424.0,200910.0,2.0,,112.0,115.7,113.1,471380.0,417881.0,,2014632762.66,88.6,975641332.96,,,,92278386451.0,39980015838.0,52298370613.0
784,05/01/2012 12:00:00 AM,2012-05-01,2012,,,,17555192.0,452894333.0,407759030.0,964418.0,1126908.0,,,,,,12660000.0,2752096.0,594778477.0,3605391.0,3494340.0,211503.0,2.0,,112.9,115.0,113.4,505616.0,460181.0,,2073984954.6600003,88.5,1052157393.2,,,,96778083077.0,43252848755.0,53525234322.0
785,06/01/2012 12:00:00 AM,2012-06-01,2012,,,,17016161.0,420261984.0,392719048.0,1209902.0,1405663.0,,,,,,12692000.0,2792266.0,642263746.0,3505967.0,3429270.0,228275.0,2.0,,113.7,115.2,114.1,481397.0,430283.0,,2057891464.66,89.5,1033210046.26,,,,94177521478.0,40989007649.0,53188513829.0
786,07/01/2012 12:00:00 AM,2012-07-01,2012,,,,17606904.0,413166330.0,396217399.0,946060.0,1103863.0,,,,,,12656000.0,2819009.0,663965533.0,3590865.0,3386646.0,217054.0,2.0,,113.5,115.0,113.9,455751.0,416027.0,,2002899956.68,89.6,995975606.01,,,,87815116544.0,40066735593.0,47748380951.0
787,08/01/2012 12:00:00 AM,2012-08-01,2012,,,,18535651.0,446218381.0,406610385.0,981879.0,1168915.0,,,,,,12471000.0,2807309.0,639545067.0,3628589.0,3537020.0,211055.0,2.0,,112.8,115.7,113.6,497866.0,442540.0,,1958822875.4,89.1,1059470438.65,,,,94847007983.0,42983776686.0,51863231297.0
788,09/01/2012 12:00:00 AM,2012-09-01,2012,,,,16284787.0,446047174.0,393365641.0,1233606.0,1445019.0,,,,,,12115000.0,2505925.0,533542490.0,3432738.0,3219452.0,200992.0,2.0,,112.1,115.7,113.1,457817.0,392223.0,,1960624096.17,88.6,1008959152.23,,,,89808523136.0,39608683719.0,50199839417.0
789,10/01/2012 12:00:00 AM,2012-10-01,2012,,,,17280855.0,484034500.0,401444963.0,1009019.0,1144443.0,,,,,,12124000.0,2597751.0,539910016.0,3494044.0,3468146.0,206106.0,2.0,,110.4,113.5,111.3,502667.0,454930.0,,1951376438.83,86.9,1057686543.16,,,,98612278400.0,45272049578.0,53340228822.0
790,11/01/2012 12:00:00 AM,2012-11-01,2012,,,,16110421.0,443807311.0,381467393.0,917619.0,1103040.0,,,,,,12005000.0,2560074.0,534831976.0,3433807.0,3257306.0,224069.0,2.0,,112.1,115.5,113.1,471541.0,427865.0,,2017292040.67,88.5,1082146564.55,,,,94927413512.0,42496032316.0,52431381196.0
791,12/01/2012 12:00:00 AM,2012-12-01,2012,,,,15143085.0,407109182.0,381180414.0,1129424.0,1394370.0,,,,,,12298000.0,2606922.0,577219034.0,3541030.0,3050809.0,205195.0,2.0,,112.1,116.2,113.3,390438.0,370217.0,,1924393862.44,89.4,1146489429.11,,,,84766155389.00002,36657639693.0,48108515696.0
792,01/01/2013 12:00:00 AM,2013-01-01,2013,,,,16109320.0,434859729.0,391456289.0,919377.0,1064974.0,,,,,,12471000.0,2605070.0,577032191.0,3514412.0,3405041.0,186378.0,2.0,,114.3,117.3,115.2,468575.0,428107.0,,1796971991.48,91.8,1028296241.57,,,,90765878450.0,39461236828.0,51304641622.0
793,02/01/2013 12:00:00 AM,2013-02-01,2013,,,,14867817.0,418613331.0,358326511.0,983076.0,1104620.0,,,,,,11950000.0,2218372.0,448821441.0,3204826.0,3059646.0,174029.0,2.0,,115.8,117.6,116.3,437245.0,408669.0,,1651348984.09,92.7,912788603.98,,,,88893531789.0,39774874887.99999,49118656901.0
794,03/01/2013 12:00:00 AM,2013-03-01,2013,,,,16561172.0,446313477.0,403677037.0,1182474.0,1401395.0,,,,,,11689000.0,2820053.0,604193668.0,3586355.0,3352597.0,187680.0,2.0,,115.9,116.3,115.9,469482.0,429118.0,,1993319383.39,92.7,1050382933.83,,,,95757359271.0,41242501378.0,54514857893.0
795,04/01/2013 12:00:00 AM,2013-04-01,2013,,,,17157125.0,460021840.0,408338611.0,962016.0,1108849.0,,,,,,11760000.0,2817093.0,603515708.0,3586955.0,3431319.0,185816.0,2.0,,115.0,117.0,115.5,491163.0,470867.0,,1938789425.58,93.1,993732913.65,,,,98956208366.0,44158961728.0,54797246638.0
796,05/01/2013 12:00:00 AM,2013-05-01,2013,,,,17602320.0,454439208.0,414493008.0,992223.0,1132673.0,,,,,,11654000.0,2816920.0,598536892.0,3623355.0,3556884.0,209991.0,2.0,,115.8,116.9,116.0,495376.0,462653.0,,1811802946.34,94.6,1047427972.28,,,,98742017238.0,43711949931.0,55030067307.0
797,06/01/2013 12:00:00 AM,2013-06-01,2013,,,,16947977.0,410181321.0,402673123.0,1231281.0,1405422.0,,,,,,11751000.0,2839089.0,638602721.0,3509052.0,3348985.0,191586.0,2.0,,116.4,117.7,116.7,476738.0,422524.0,,1857777405.77,94.3,1012812397.84,,,,93502224618.0,40916593664.0,52585630954.0
798,07/01/2013 12:00:00 AM,2013-07-01,2013,,,,18213366.0,423153518.0,404783745.0,963616.0,1096854.0,,,,,,11335000.0,2954693.0,681357191.0,3634796.0,3454988.0,195994.0,2.0,,116.0,116.8,116.1,466391.0,435699.0,,1867457546.27,94.4,996949275.42,,,,93079911151.0,43147555661.0,49932355490.0
799,08/01/2013 12:00:00 AM,2013-08-01,2013,,,,18449857.0,438404651.0,408956277.0,1286188.0,1466614.0,,,,,,11279000.0,3022917.0,678920983.0,3635022.0,3465110.0,195728.0,2.0,,116.6,117.5,116.8,476948.0,435400.0,,1827193653.33,94.7,1066190158.07,,,,96426146278.0,43204211245.0,53221935033.0
800,09/01/2013 12:00:00 AM,2013-09-01,2013,,,,16833246.0,452493755.0,409342055.0,1027239.0,1159594.0,,,,,,11270000.0,3000209.0,676533520.0,3612251.0,3341962.0,190766.0,2.0,,116.5,117.5,116.7,477120.0,405484.0,,1802995289.92,95.4,981917194.0,,,,94464755457.0,41343520815.0,53121234642.0
801,10/01/2013 12:00:00 AM,2013-10-01,2013,,,,17784139.0,490525380.0,441769917.0,1053451.0,1151329.0,,,,,,11136000.0,2981487.0,674078738.0,3583717.0,3569455.0,185412.0,2.0,,116.5,117.6,116.8,514270.0,469158.0,,1961455968.8600004,94.7,1126408044.91,,,,103139576279.0,46399928208.0,56739648071.0
802,11/01/2013 12:00:00 AM,2013-11-01,2013,,,,15539992.0,428507640.0,396649178.0,1271818.0,1438131.0,,,,,,10787000.0,2551403.0,519835331.0,3415824.0,3215963.0,197024.0,2.0,,118.9,118.7,118.7,462484.0,428552.0,,1990982539.01,97.2,1018334919.17,,,,96136381816.0,43025295193.0,53111086623.0
803,12/01/2013 12:00:00 AM,2013-12-01,2013,,,,15301670.0,408088609.0,392250334.0,958552.0,1078826.0,,,,,,10404000.0,2714676.0,604977613.0,3541085.0,3134233.0,187520.0,2.0,,117.8,117.8,117.6,412866.0,398636.0,,1876658723.26,95.6,1192265765.49,,,,90906239877.0,40221239809.0,50685000068.0
804,01/01/2014 12:00:00 AM,2014-01-01,2014,,,,15418762.0,412868179.0,381616588.0,936306.0,1075180.0,,,,,,10202000.0,2207290.0,466418567.0,3438223.0,3405628.0,188489.0,2.0,,116.0,117.8,116.5,459050.0,443209.0,,1687694623.2399998,93.1,1032962440.72,,,,90325887200.0,41050275238.0,49275611962.0
805,02/01/2014 12:00:00 AM,2014-02-01,2014,,,,14562295.0,403328380.0,372730122.0,983107.0,1084629.0,,,,,,10349000.0,2094114.0,424362057.0,3137342.0,3082904.0,160953.0,2.0,,118.0,118.5,118.1,444749.0,422277.0,,1515282822.48,95.3,909761543.2,,,,89556626163.0,40668729607.99999,48887896555.0
806,03/01/2014 12:00:00 AM,2014-03-01,2014,,,,16630120.0,447688654.0,426393158.0,1283747.0,1444125.0,,,,,,10380000.0,2579356.0,542911331.0,3494065.0,3407824.0,174214.0,2.0,,119.9,119.8,119.7,494908.0,467828.0,,1982222681.09,96.2,1059970327.78,,,,101478268130.99998,44852547722.0,56625720409.0
807,04/01/2014 12:00:00 AM,2014-04-01,2014,,,,17478272.0,452469919.0,428575468.0,1048812.0,1184375.0,,,,,,9702000.0,2594901.0,545773080.0,3460995.0,3391032.0,187309.0,2.0,,120.5,119.8,120.2,496986.0,468263.0,,1861694094.76,96.8,1062638586.1,,,,100141133944.0,44369631232.0,55771502712.00001
808,05/01/2014 12:00:00 AM,2014-05-01,2014,,,,17522501.0,448165670.0,436112383.0,1313260.0,1483205.0,,,,,,9859000.0,2746886.0,581325298.0,3597399.0,3481420.0,208164.0,2.0,,120.9,120.4,120.6,503633.0,474277.0,,1953087463.62,97.2,1069655137.48,,,,103941947006.0,46291061964.0,57650885042.0
809,06/01/2014 12:00:00 AM,2014-06-01,2014,,,,17512595.0,416801173.0,418151708.0,1077352.0,1178082.0,,,,,,9460000.0,2802647.0,624637290.0,3503581.0,3378785.0,196924.0,2.0,,119.7,119.4,119.5,502196.0,446531.0,,1912660660.87,97.1,1020305284.61,,,,102978380501.0,45075106716.0,57903273785.0
810,07/01/2014 12:00:00 AM,2014-07-01,2014,,,,18970782.0,423494448.0,421380740.0,1016079.0,1167422.0,,,,,,9608000.0,2970213.0,672539892.0,3604475.0,3455397.0,192326.0,2.0,,120.3,119.8,120.0,493212.0,461001.0,,1996332147.99,97.3,1085373201.19,,,,101074813682.0,45881962777.0,55192850905.0
811,08/01/2014 12:00:00 AM,2014-08-01,2014,,,,18432301.0,426763698.0,419725564.0,1346024.0,1516345.0,,,,,,9599000.0,2928658.0,649665562.0,3600640.0,3376944.0,191436.0,2.0,,120.8,120.3,120.5,472788.0,442428.0,,1895746703.38,98.5,1070141512.1,,,,100624137177.0,45103096253.0,55521040924.0
812,09/01/2014 12:00:00 AM,2014-09-01,2014,,,,17592118.0,462192187.0,429130674.0,1073027.0,1190437.0,,,,,,9262000.0,2571623.0,540029397.0,3544931.0,3364598.0,188884.0,2.0,,121.7,120.3,121.1,509506.0,440589.0,,1869390688.18,99.0,1028581499.31,,,,102244906316.0,44878925400.00001,57365980916.0
813,10/01/2014 12:00:00 AM,2014-10-01,2014,,,,18387323.0,491245387.0,454743586.0,1101932.0,1202804.0,,,,,,8990000.0,2704061.0,554539946.0,3502663.0,3576941.0,208850.0,2.0,,122.5,120.2,121.6,520041.0,489258.0,,2056676557.08,99.3,1144871737.4,,,,108242839558.0,49668119225.0,58574720333.0
814,11/01/2014 12:00:00 AM,2014-11-01,2014,,,,15293676.0,413702364.0,391152307.0,1314818.0,1467018.0,,,,,,9090000.0,2668465.0,546544981.0,3336679.0,3111840.0,193036.0,2.0,,123.2,119.8,121.9,459342.0,427444.0,,2049498247.25,100.0,1100759183.16,,,,96251667092.0,43893497904.0,52358169188.0
815,12/01/2014 12:00:00 AM,2014-12-01,2014,,,,16277932.0,418703626.0,407598338.0,1002750.0,1184405.0,,,,,,8717000.0,2658904.0,587913029.0,3426322.0,3176421.0,191291.0,2.0,,123.0,120.7,122.1,445798.0,431463.0,,1980796814.0,99.5,1260214072.2499998,,,,95810842251.0,42750703934.0,53060138317.0
816,01/01/2015 12:00:00 AM,2015-01-01,2015,,,,15481236.0,406792856.0,373107679.0,1190773.0,1421315.0,,,,,,8885000.0,2194509.0,458200128.0,3406940.0,3260091.0,181864.0,2.0,,122.8,120.3,121.8,464683.0,447705.0,,1799112411.3,99.1,1043068324.86,,,,89258484741.0,41205262520.00001,48053222221.0
817,02/01/2015 12:00:00 AM,2015-02-01,2015,,,,14776228.0,391716828.0,351242138.0,929348.0,1089174.0,,,,,,8599000.0,2167689.0,430056703.0,3163862.0,3032522.0,189071.0,2.0,,122.1,119.9,121.2,440692.0,434241.0,,1742665774.74,98.5,1008060853.4,,,,85723164022.0,40603051866.0,45120112156.0
818,03/01/2015 12:00:00 AM,2015-03-01,2015,,,,17212906.0,445890962.0,421479443.0,1084130.0,1116976.0,,,,,,8515000.0,2679096.0,556689651.0,3452210.0,3449427.0,193652.0,2.0,,123.0,121.4,122.3,511097.0,490307.0,,2024425286.97,101.1,1115751887.51,,,,96070329989.0,45238915959.0,50831414030.0
819,04/01/2015 12:00:00 AM,2015-04-01,2015,,,,17783008.0,441944313.0,419355087.0,1100642.0,1119309.0,,,,,,8550000.0,2625765.0,541203782.0,3376328.0,3362867.0,192878.0,2.0,,121.8,121.6,121.6,486437.0,475780.0,,1958791601.44,98.5,1088648940.4,,,,93326525413.0,44509409463.0,48817115950.0
820,05/01/2015 12:00:00 AM,2015-05-01,2015,,,,17543829.0,425134377.0,406499441.0,1368681.0,1356835.0,,,,,,8834000.0,2534363.0,539871332.0,3530957.0,3356582.0,216237.0,2.0,,122.0,121.7,121.8,483697.0,468216.0,,1910008128.29,99.5,1064995139.05,,,,92707126400.0,43823453261.0,48883673139.0
821,06/01/2015 12:00:00 AM,2015-06-01,2015,,,,18574710.0,415136968.0,422218925.0,1117139.0,1087058.0,,,,,,8247000.0,2798343.0,620954019.0,3421147.0,3445368.0,201226.0,2.0,,121.8,121.9,121.7,508300.0,481539.0,,1886578246.9,99.5,1067766852.63,,,,99029822035.0,47075182893.0,51954639142.0
822,07/01/2015 12:00:00 AM,2015-07-01,2015,,,,19614863.0,414987604.0,432859298.0,1062425.0,1086841.0,,,,,,8167000.0,2987128.0,680358542.0,3530697.0,3468209.0,200614.0,2.0,,122.6,124.4,123.1,477110.0,470243.0,,1904820268.53,100.2,1097254556.44,,,,92994907276.0,45532614507.0,47462292769.0
823,08/01/2015 12:00:00 AM,2015-08-01,2015,,,,19077233.0,413682682.0,385317293.0,1383841.0,1445717.0,,,,,,7992000.0,2814865.0,627586111.0,3508754.0,3377963.0,200671.0,2.0,,123.2,122.7,122.9,480690.0,433282.0,,1832226734.85,100.9,1057059070.81,,,,92442499178.0,44491642165.0,47950857013.0
824,09/01/2015 12:00:00 AM,2015-09-01,2015,,,,18036140.0,443018225.0,413854787.0,1083932.0,1127414.0,,,,,,7907000.0,2522953.0,519017227.0,3411361.0,3344550.0,197278.0,2.0,,123.2,123.5,123.2,500069.0,455664.0,,1917484118.15,100.8,1087086122.57,,,,93246362945.0,44951017765.0,48295345180.0
825,10/01/2015 12:00:00 AM,2015-10-01,2015,,,,18222215.0,463955116.0,448352817.0,1370911.0,1414802.0,,,,,,7922000.0,2638375.0,523223360.0,3437979.0,3492242.0,199395.0,2.0,,122.8,124.4,123.3,508661.0,488679.0,,2041253447.28,100.7,1166026079.48,,,,96624389519.99998,48902849946.0,47721539574.0
826,11/01/2015 12:00:00 AM,2015-11-01,2015,,,,16026042.0,411420986.0,398861146.0,1024592.0,1041813.0,,,,,,8000000.0,2649324.0,538968201.0,3312949.0,3166559.0,188820.0,2.0,,120.9,123.6,121.7,486513.0,449882.0,,2019995104.03,99.7,1085222652.64,,,,88153882404.0,43043220129.0,45110662275.0
827,12/01/2015 12:00:00 AM,2015-12-01,2015,,,,16586781.0,406962247.0,405053920.0,992011.0,1011582.0,,,,,,7907000.0,2586422.0,561992627.0,3412727.0,3198897.0,188135.0,2.0,,120.5,124.6,121.8,443072.0,439833.0,,1966888815.23,101.1,1309495486.15,,,,86747943170.99998,41741857450.0,45006085721.0
828,01/01/2016 12:00:00 AM,2016-01-01,2016,,,,15430528.0,386755389.0,370877899.0,1227533.0,1175934.0,,,,,,7721000.0,2182579.0,443214812.0,3348646.0,3217713.0,188020.0,2.0,39800000.0,122.4,124.3,122.9,470264.0,443705.0,,1783341445.21,102.7,1032305811.62,,,,82429671243.0,40466506947.0,41963164295.99999
829,02/01/2016 12:00:00 AM,2016-02-01,2016,,,,15881011.0,407901595.0,385782568.0,1049089.0,978899.0,,,,,,7746000.0,2217808.0,425393477.0,3226757.0,3146006.0,190307.0,2.0,42900000.0,121.7,126.4,123.3,476753.0,468416.0,,1606080027.22,102.1,952297220.57,,,,84037738682.0,41418037155.0,42619701527.0
830,03/01/2016 12:00:00 AM,2016-03-01,2016,,,,17947740.0,439052186.0,426988229.0,997045.0,958201.0,,,,,,7945000.0,2730170.0,555131660.0,3465504.0,3424773.0,191418.0,2.0,44200000.0,120.7,123.0,121.4,515426.0,498711.0,,1945220919.75,101.8,1138149480.76,,,,90461534520.0,44082862796.0,46378671724.0
831,04/01/2016 12:00:00 AM,2016-04-01,2016,,,,17551284.0,420637828.0,409660770.0,1282501.0,1182456.0,,,,,,7975000.0,2540725.0,512433020.0,3345959.0,3324587.0,201637.0,2.0,45100000.0,123.1,124.1,123.3,489728.0,506557.0,,1954284062.46,103.2,1092553368.65,,,,90380196734.0,44483463525.0,45896733209.0
832,05/01/2016 12:00:00 AM,2016-05-01,2016,,,,18088573.0,413648699.0,425163795.0,1049670.0,962461.0,,,,,,7668000.0,2773454.0,571922265.0,3465594.0,3388908.0,201004.0,2.0,46400000.0,122.3,124.5,123.0,507631.0,501367.0,,1902233058.58,102.1,1076074479.2,,,,89840164274.0,43883063612.0,45957100662.0
833,06/01/2016 12:00:00 AM,2016-06-01,2016,,,,18802734.0,398921201.0,426663431.0,1029935.0,980848.0,,,,,,7786000.0,2873730.0,624827889.0,3386323.0,3346761.0,197954.0,2.0,44900000.0,123.2,125.1,123.7,517164.0,496423.0,,1904696199.41,102.4,1145565452.61,,,,92671056257.0,44462903363.0,48208152894.0
834,07/01/2016 12:00:00 AM,2016-07-01,2016,,,,18621062.0,375914623.0,391196457.0,1267654.0,1289596.0,,,,,,7658000.0,3055054.0,681258622.0,3479641.0,3184975.0,199499.0,2.0,47000000.0,125.6,124.4,125.0,453281.0,439231.0,,1925598063.57,104.9,1106082698.64,,,,83725477046.0,41329568197.0,42395908849.0
835,08/01/2016 12:00:00 AM,2016-08-01,2016,,,,19893326.0,410037936.0,410797109.0,1061512.0,1074842.0,,,,,,7809000.0,2878610.0,622399656.0,3497508.0,3415722.0,195709.0,2.0,49400000.0,123.5,123.2,123.3,522773.0,504059.0,,1923319713.59,101.4,1166538861.1,,,,93126240202.0,45839796294.0,47286443908.0
836,09/01/2016 12:00:00 AM,2016-09-01,2016,,,,18116568.0,427679116.0,414955301.0,1034721.0,1064713.0,,,,,,7967000.0,2641410.0,529746419.0,3371411.0,3221852.0,203411.0,2.0,47500000.0,122.2,126.2,123.5,497132.0,481245.0,,1961844597.05,100.1,1182533534.65,,,,91126004128.0,44934944490.0,46191059638.0
837,10/01/2016 12:00:00 AM,2016-10-01,2016,,,,17566523.0,427759202.0,420310003.0,1347849.0,1344087.0,,,,,,7827000.0,2619410.0,515715563.0,3458986.0,3313513.0,186990.0,2.0,49900000.0,123.0,123.7,123.1,505275.0,499700.0,,2154429334.82,101.6,1209485582.85,,,,93164740953.0,46616783161.0,46547957792.0
838,11/01/2016 12:00:00 AM,2016-11-01,2016,,,,16496665.0,399448050.0,401096574.0,1040361.0,1044509.0,,,,,,7488000.0,2714255.0,541014515.0,3444562.0,3139114.0,179751.0,2.0,46100000.0,123.2,125.0,123.7,492637.0,492340.0,,2133673058.85,102.2,1263543456.58,,,,91089170345.0,44977982012.0,46111188333.0
839,12/01/2016 12:00:00 AM,2016-12-01,2016,,,,15954953.0,376472088.0,392248503.0,1290680.0,1248201.0,,,,,,7495000.0,2676894.0,562539179.0,3507901.0,3044631.0,180597.0,2.0,44900000.0,124.6,125.7,124.8,429874.0,471027.0,,2063059952.66,103.2,1392905473.21,,,,87085563341.0,42614228582.0,44471334759.0
840,01/01/2017 12:00:00 AM,2017-01-01,2017,62620000.0,8510000.0,54110000.0,15695383.0,379032287.0,385406234.0,999980.0,990999.0,,,,,,7518000.0,2330923.0,458016423.0,3432608.0,3215098.0,177548.0,2.0,43900000.0,124.0,126.9,124.9,483159.0,482882.0,,1861554096.83,103.0,1131530024.67,62620000.0,8510000.0,54110000.0,87960384375.0,43015358618.0,44945025757.0
841,02/01/2017 12:00:00 AM,2017-02-01,2017,58380000.0,7300000.0,51080000.0,15160465.0,373246708.0,367315442.0,1045836.0,1038433.0,,,,,,7399000.0,2153891.0,405865664.0,3121837.0,2921855.0,164751.0,2.0,43000000.0,124.6,125.9,124.9,453800.0,469120.0,,1680567551.4099998,104.0,1029816836.34,58380000.0,7300000.0,51080000.0,86474172442.0,42056618171.0,44417554271.0
842,03/01/2017 12:00:00 AM,2017-03-01,2017,72960000.0,9000000.0,63960000.0,17507282.0,415647479.0,430111836.0,1007335.0,1017513.0,,,,,,7088000.0,2659548.0,530748447.0,3464598.0,3410941.0,196791.0,2.0,47700000.0,125.1,125.9,125.2,522488.0,537552.0,,2155152971.9,103.1,1280819613.99,72960000.0,9000000.0,63960000.0,100288933781.0,49076097695.0,51212836086.0
843,04/01/2017 12:00:00 AM,2017-04-01,2017,70260000.0,9160000.0,61100000.0,17044306.0,388066756.0,407072908.0,1291296.0,1275287.0,,,,,,7085000.0,2764389.0,561148298.0,3342228.0,3156697.0,190095.0,2.0,44100000.0,125.4,127.0,125.9,477189.0,483439.0,,2065234187.5,104.5,1184722088.18,70260000.0,9160000.0,61100000.0,91067617386.0,44021255569.0,47046361817.0
844,05/01/2017 12:00:00 AM,2017-05-01,2017,73680000.0,9240000.0,64440000.0,18539625.0,405517838.0,429163483.0,1069859.0,1026679.0,,,,,,7059000.0,2822981.0,574606036.0,3487216.0,3345829.0,188425.0,2.0,42600000.0,125.9,126.6,126.0,527854.0,526011.0,,2159376799.77,104.8,1236289808.26,73680000.0,9240000.0,64440000.0,98246033725.00002,47044729236.0,51201304489.0
845,06/01/2017 12:00:00 AM,2017-06-01,2017,77010000.0,10260000.0,66750000.0,18968564.0,381873194.0,419263030.0,1063167.0,1042366.0,,,,,,6933000.0,2939540.0,636313142.0,3445197.0,3277866.0,187714.0,2.0,44700000.0,126.2,126.7,126.2,512687.0,527022.0,,2179682642.73,104.0,1262941105.67,77010000.0,10260000.0,66750000.0,99764164610.0,48659499233.0,51104665377.0
846,07/01/2017 12:00:00 AM,2017-07-01,2017,79820000.0,11240000.0,68580000.0,19283551.0,361210003.0,388539014.0,1306811.0,1282053.0,,,,,,6867000.0,3012988.0,667515087.0,3475556.0,3173703.0,191217.0,2.0,45700000.0,128.4,127.0,127.7,461295.0,481582.0,,2242811763.8300004,107.3,1208603548.78,79820000.0,11240000.0,68580000.0,89174993506.0,44399051534.0,44775941972.0
847,08/01/2017 12:00:00 AM,2017-08-01,2017,77100000.0,10440000.0,66670000.0,20389454.0,392451528.0,402576595.0,1101439.0,1079993.0,,,,,,7097000.0,2943592.0,628885839.0,3504171.0,3396425.0,192000.0,2.0,47000000.0,128.9,126.8,127.9,515625.0,523705.0,,2218998323.87,108.2,1315007968.43,77100000.0,10440000.0,66670000.0,97439343152.00002,47915706966.0,49523636186.0
848,09/01/2017 12:00:00 AM,2017-09-01,2017,64920000.0,7770000.0,57150000.0,17975512.0,398194634.0,407759984.0,1332867.0,1295694.0,,,,,,6841000.0,2604788.0,511006011.0,3335568.0,3160709.0,198213.0,2.0,44000000.0,128.7,124.9,127.1,478231.0,493093.0,,2257636368.14,108.7,1256900240.2,64920000.0,7770000.0,57150000.0,94378991539.0,45878668064.0,48500323475.0
849,10/01/2017 12:00:00 AM,2017-10-01,2017,72700000.0,8080000.0,64629999.99999999,18699035.0,425403015.0,444700375.0,1385368.0,1325439.0,,,,,,6599000.0,2788447.0,544835510.0,3486367.0,3352708.0,180924.0,2.0,45700000.0,130.1,127.8,129.1,505480.0,536285.0,,2396985579.21,109.2,1328516998.97,72700000.0,8080000.0,64629999.99999999,100561436175.99998,50835149339.0,49726286837.0
850,11/01/2017 12:00:00 AM,2017-11-01,2017,69630000.0,7720000.0,61910000.0,16992247.0,390921668.0,401710224.0,1073673.0,1034485.0,,,,,,6697000.0,2805180.0,552222667.0,3371702.0,3160305.0,174755.0,2.0,46600000.0,131.6,128.5,130.3,493062.0,513361.0,,2434473351.4300003,109.9,1411034576.84,69630000.0,7720000.0,61910000.0,100612606774.0,49322067596.0,51290539178.0
851,12/01/2017 12:00:00 AM,2017-12-01,2017,70330000.0,8960000.0,61370000.0,15916113.0,357674882.0,378224139.0,1044001.0,992839.0,,,,,,6561000.0,2685874.0,558435738.0,3426697.0,2992572.0,173430.0,2.0,43900000.0,133.5,128.2,131.4,415723.0,465722.0,,2316138277.12,112.0,1493693931.34,70330000.0,8960000.0,61370000.0,93512090967.0,44809655599.0,48702435367.99999
852,01/01/2018 12:00:00 AM,2018-01-01,2018,64430000.00000001,8600000.0,55830000.0,16028440.0,369920847.0,381378921.0,1310160.0,1217433.0,244736000000.0,70351000000.0,24901000000.0,27072000000.0,18378000000.0,6582000.0,2308715.0,438710211.0,3428324.0,3222581.0,174582.0,2.0,45000000.0,131.5,128.3,130.1,475119.0,517144.0,0.7935483974756,2143409081.83,109.1,1257997125.21,64430000.00000001,8600000.0,55830000.0,96648309055.0,47741273235.0,48907035820.0
853,02/01/2018 12:00:00 AM,2018-02-01,2018,61720000.0,7640000.0,54080000.0,15483048.0,364782170.0,364857431.0,1104001.0,1028141.0,227759000000.0,65500000000.0,22958000000.0,25682000000.0,16860000000.0,6641000.0,2162715.0,397611189.0,3124006.0,2891269.0,162523.0,2.0,43900000.0,133.7,130.1,132.2,448194.0,491399.0,0.7892740918432,1937323471.68,111.6,1147866027.4,61720000.0,7640000.0,54080000.0,93965981299.0,46512535687.0,47453445612.0
854,03/01/2018 12:00:00 AM,2018-03-01,2018,76290000.0,9650000.0,66640000.0,17296690.0,393604986.0,408856449.0,1082239.0,1050653.0,270705000000.0,79690000000.0,28069000000.0,30867000000.0,20755000000.0,6493000.0,2566889.0,507584752.0,3380368.0,3253429.0,192729.0,2.0,49800000.0,135.7,129.2,133.1,500026.0,534661.0,0.807369970412,2412818775.21,112.5,1338314103.95,76290000.0,9650000.0,66640000.0,105767083321.0,51864872420.0,53902210901.0
855,04/01/2018 12:00:00 AM,2018-04-01,2018,73630000.0,9070000.0,64560000.0,17566326.0,392252372.0,398115089.0,1099000.0,1051026.0,275127000000.0,81961000000.0,29243000000.0,31251000000.0,21466000000.0,6418000.0,2595973.0,502623911.0,3398092.0,3138092.0,177238.0,2.0,52500000.0,135.4,129.9,133.2,501741.0,542965.0,0.8128910685754,2306569616.99,111.7,1244529918.61,73630000.0,9070000.0,64560000.0,102699718587.0,50518822379.0,52180896208.0
856,05/01/2018 12:00:00 AM,2018-05-01,2018,77300000.0,9450000.0,67840000.0,19092459.0,400194774.0,417646812.0,1398203.0,1319420.0,283713000000.0,86612000000.0,30562000000.0,33288000000.0,22762000000.0,6209000.0,2794122.0,556052014.0,3495513.0,3289612.0,189787.0,2.0,54200000.0,136.4,130.5,134.0,524191.0,561452.0,0.7923831131517,2402535270.01,113.3,1351698134.73,77300000.0,9450000.0,67840000.0,107250618122.0,52126514763.0,55124103359.0
857,06/01/2018 12:00:00 AM,2018-06-01,2018,80880000.0,10610000.0,70280000.0,19026788.0,373053040.0,409866112.0,1159973.0,1080769.0,282648000000.0,87427000000.0,30742000000.0,33817000000.0,22868000000.0,6519000.0,2910516.0,600475156.0,3430809.0,3141882.0,188695.0,2.0,53800000.0,137.2,131.2,134.8,498422.0,529177.0,0.7638121992488,2383925587.82,114.5,1316743895.37,80880000.0,10610000.0,70280000.0,106164224635.0,51841384666.0,54322839969.0
858,07/01/2018 12:00:00 AM,2018-07-01,2018,83960000.0,11420000.0,72540000.0,20086591.0,362119816.0,394287833.0,1108142.0,1048293.0,290989000000.0,93400000000.0,32128000000.0,36127000000.0,25145000000.0,6180000.0,3063808.0,655798387.0,3537038.0,3170620.0,192013.0,2.0,49800000.0,135.9,131.4,134.1,482545.0,514241.0,0.7596430164088,2365353566.33,113.3,1287661024.73,83960000.0,11420000.0,72540000.0,101211760010.0,50939109957.0,50272650053.0
859,08/01/2018 12:00:00 AM,2018-08-01,2018,80990000.0,10650000.0,70340000.0,20706799.0,392397741.0,398554199.0,1442920.0,1386026.0,284989000000.0,89671000000.0,31044000000.0,34782000000.0,23845000000.0,6167000.0,2983033.0,622165201.0,3561821.0,3313250.0,192110.0,2.0,52000000.0,136.0,131.2,134.0,508622.0,552741.0,0.7522680449118,2292000290.41,113.8,1378745514.43,80990000.0,10650000.0,70340000.0,106897116708.0,53553844685.0,53343272023.0
860,09/01/2018 12:00:00 AM,2018-09-01,2018,68700000.0,8230000.0,60470000.0,17958523.0,385074986.0,392230685.0,1127385.0,1066826.0,267434000000.0,82245000000.0,28675000000.0,32284000000.0,21286000000.0,6045000.0,2583522.0,495908489.0,3314827.0,3051491.0,204432.0,2.0,50300000.0,137.9,129.6,134.6,477492.0,494057.0,0.8190737113491,2378773382.02,114.7,1320407506.23,68700000.0,8230000.0,60470000.0,101626553096.0,50634138748.0,50992414348.0
861,10/01/2018 12:00:00 AM,2018-10-01,2018,75510000.0,8420000.0,67080000.0,19378046.0,437208668.0,443479335.0,1443914.0,1338037.0,281382000000.0,85575000000.0,29950000000.0,33499000000.0,22126000000.0,6123000.0,2809806.0,541695863.0,3495697.0,3317689.0,182051.0,2.0,56200000.0,138.9,131.7,136.1,527247.0,568252.0,0.8229107608573,2531090174.28,115.8,1416350707.63,75510000.0,8420000.0,67080000.0,110795597732.0,56580838567.99999,54214759164.0
862,11/01/2018 12:00:00 AM,2018-11-01,2018,72740000.0,8080000.0,64660000.0,16960779.0,381708475.0,392683202.0,1100815.0,1032067.0,260473000000.0,77687000000.0,26662000000.0,30277000000.0,20747000000.0,6034000.0,2875062.0,561549866.0,3388609.0,3022043.0,176801.0,2.0,50200000.0,139.3,131.5,136.2,476793.0,535417.0,0.7926816482566,2416461080.53,116.7,1397111161.89,72740000.0,8080000.0,64660000.0,103042822914.99998,52638852403.0,50403970512.0
863,12/01/2018 12:00:00 AM,2018-12-01,2018,72880000.0,9240000.0,63650000.0,16101861.0,356661196.0,369546197.0,1096116.0,1021978.0,270370000000.0,78682000000.0,27097000000.0,30583000000.0,21002000000.0,6286000.0,2672584.0,551882741.0,3400344.0,2850120.0,178475.0,2.0,50200000.0,137.3,131.3,134.9,410534.0,469397.0,0.7998518869784,2330529913.35,115.2,1511257823.43,72880000.0,9240000.0,63650000.0,92668412854.0,46585908439.0,46082504415.0
864,01/01/2019 12:00:00 AM,2019-01-01,2019,67019999.99999999,8980000.0,58030000.0,16550971.0,367921738.0,368022820.0,1316168.0,1238487.0,248395000000.0,71450000000.0,25101000000.0,27615000000.0,18734000000.0,6516000.0,2288770.0,443790117.0,3417817.0,3185889.0,177672.0,2.0,48200000.0,138.6,131.6,135.8,467770.0,544903.0,0.783429650129,2177435751.36,115.8,1323554381.06,67019999.99999999,8980000.0,58030000.0,95623079535.0,49595329029.0,46027750506.0
865,02/01/2019 12:00:00 AM,2019-02-01,2019,63580000.0,7900000.0,55680000.0,15166147.0,354764697.0,350068247.0,1094499.0,999978.0,226799000000.0,65277000000.0,22764000000.0,25662000000.0,16851000000.0,6181000.0,2164554.0,400576951.0,3112920.0,2877892.0,164452.0,2.0,39500000.0,137.3,132.0,135.1,429813.0,512524.0,0.7375769527566,1867678286.06,115.8,1148955024.09,63580000.0,7900000.0,55680000.0,94188982942.0,47822601240.00001,46366381702.0
866,03/01/2019 12:00:00 AM,2019-03-01,2019,80210000.0,9980000.0,70230000.0,17801626.0,390318897.0,403221955.0,1065841.0,956821.0,271668000000.0,79928000000.0,27977000000.0,31012000000.0,20939000000.0,6194000.0,2692861.0,517020057.0,3494111.0,3222021.0,190018.0,2.0,46000000.0,138.2,134.8,136.6,488046.0,562555.0,0.8087377401566,2428280991.84,116.7,1354156574.85,80210000.0,9980000.0,70230000.0,107229859645.00002,53165179483.0,54064680162.0
867,04/01/2019 12:00:00 AM,2019-04-01,2019,76430000.0,9490000.0,66940000.0,18753542.0,397568767.0,415529108.0,1322588.0,1310228.0,281646000000.0,84394000000.0,30050000000.0,32269000000.0,22075000000.0,5850000.0,2728995.0,532041046.0,3405853.0,3156890.0,177472.0,2.0,51000000.0,139.1,133.6,136.9,480477.0,524215.0,0.7978766061608,2274296148.62,117.2,1344144918.27,76430000.0,9490000.0,66940000.0,104548781572.0,52596204519.99999,51952577052.0
868,05/01/2019 12:00:00 AM,2019-05-01,2019,81350000.0,9980000.0,71370000.0,19574692.0,399731393.0,421135195.0,1049163.0,1023136.0,286269000000.0,87500000000.0,30687000000.0,33645000000.0,23167000000.0,5938000.0,2897825.0,576765031.0,3535458.0,3264618.0,194725.0,2.0,52400000.0,139.4,135.3,137.6,507425.0,576724.0,0.7788102590101,2347935661.8900003,117.3,1397362976.43,81350000.0,9980000.0,71370000.0,109795888398.0,54545009062.0,55250879335.99999
869,06/01/2019 12:00:00 AM,2019-06-01,2019,83840000.0,11050000.0,72790000.0,18948515.0,362071571.0,398790794.0,1075927.0,1023231.0,281345000000.0,87384000000.0,30525000000.0,33858000000.0,23002000000.0,5985000.0,2988187.0,618224369.0,3387252.0,3086515.0,185634.0,2.0,50100000.0,138.9,134.5,137.0,485867.0,533555.0,0.7330748252695,2242323812.09,118.2,1353833324.46,83840000.0,11050000.0,72790000.0,103765796868.0,51162064279.0,52603732589.0
870,07/01/2019 12:00:00 AM,2019-07-01,2019,86960000.0,11670000.0,75280000.0,20296780.0,367912258.0,410355718.0,1314363.0,1264354.0,295744000000.0,94815000000.0,32732000000.0,36666000000.0,25417000000.0,6027000.0,3108797.0,657244637.0,3523575.0,3241361.0,193669.0,2.0,49600000.0,139.7,134.7,137.6,478767.0,552492.0,0.7691966885591,2283098811.0200005,118.6,1372525561.98,86960000.0,11670000.0,75280000.0,102441390634.0,52220787968.0,50220602666.0
871,08/01/2019 12:00:00 AM,2019-08-01,2019,83780000.0,11070000.0,72720000.0,20579850.0,383164093.0,409121767.0,,,286857000000.0,90787000000.0,31380000000.0,35215000000.0,24192000000.0,5999000.0,3056574.0,626644744.0,3566282.0,3291356.0,207037.0,2.0,54300000.0,141.2,135.3,138.8,485797.0,549757.0,0.7754393251208,2259535654.65,120.0,1410974294.62,83780000.0,11070000.0,72720000.0,105102970454.0,53101214084.0,52001756370.0
872,09/01/2019 12:00:00 AM,2019-09-01,2019,72590000.0,8610000.0,63980000.0,18403349.0,395175708.0,409946874.0,1061483.0,992542.0,271986000000.0,83642000000.0,29248000000.0,32912000000.0,21482000000.0,5753000.0,2748268.0,528336348.0,3388490.0,3045856.0,184628.0,2.0,49300000.0,137.8,135.1,136.6,482147.0,514257.0,0.8411868157149,2223943365.92,117.0,1304837720.14,72590000.0,8610000.0,63980000.0,101434882134.0,50148716087.0,51286166047.0
873,10/01/2019 12:00:00 AM,2019-10-01,2019,78620000.0,8690000.0,69920000.0,19174818.0,424665246.0,447221727.0,,,284203000000.0,86765000000.0,30402000000.0,33957000000.0,22406000000.0,5857000.0,2856692.0,540165523.0,3535184.0,3314190.0,185349.0,2.0,54200000.0,138.2,134.9,136.8,501929.0,574078.0,0.8222702924234,2399210858.01,117.7,1433811470.34,78620000.0,8690000.0,69920000.0,107112005583.99998,53351771221.0,53760234363.0
874,11/01/2019 12:00:00 AM,2019-11-01,2019,73070000.0,8260000.0,64819999.99999999,16379272.0,371229105.0,404521627.0,,,260333000000.0,77563000000.0,26809000000.0,30302000000.0,20452000000.0,5811000.0,2788274.0,524186383.0,3405480.0,2950851.0,180909.0,2.0,51100000.0,137.9,136.0,137.1,455384.0,518084.0,0.8438721180149,2436534901.16,117.0,1413879505.88,73070000.0,8260000.0,64819999.99999999,99031553698.99998,50104482560.0,48927071139.0
875,12/01/2019 12:00:00 AM,2019-12-01,2019,79300000.0,9580000.0,69720000.0,16275553.0,351029147.0,400395037.0,990934.0,928102.0,273844000000.0,80395000000.0,27483000000.0,31257000000.0,21654000000.0,5753000.0,2791252.0,524685446.0,3404907.0,2918102.0,179475.0,2.0,50000000.0,136.5,137.1,136.7,417733.0,477111.0,0.7816884216966,2119993327.56,116.3,1555342907.55,79300000.0,9580000.0,69720000.0,96342484233.0,46686731162.0,49655753071.0
876,01/01/2020 12:00:00 AM,2020-01-01,2020,70760000.0,9150000.0,61610000.0,16646680.0,374048323.0,404100594.0,1245080.0,1165733.0,,,,,,5892000.0,2399424.0,447564878.0,3505313.0,3147306.0,182445.0,2.0,48100000.0,136.8,138.0,137.3,457339.0,544303.0,0.8457443023987,2041418389.45,116.7,1322461187.39,70760000.0,9150000.0,61610000.0,97092315188.0,49165712006.0,47926603182.0
877,02/01/2020 12:00:00 AM,2020-02-01,2020,67810000.0,7960000.0,59850000.0,15965037.0,364028995.0,389731858.0,997683.0,927084.0,,,,,,5787000.0,2163475.0,400433113.0,3124037.0,2945522.0,174288.0,2.0,44000000.0,136.0,136.9,136.4,440166.0,520176.0,,1781338361.0100002,116.9,1173055367.92,67810000.0,7960000.0,59850000.0,95949291513.0,48455575322.0,47493716191.0
878,03/01/2020 12:00:00 AM,2020-03-01,2020,39060000.0,4650000.0,34410000.0,10749868.0,245160489.0,215905806.0,935380.0,899673.0,,,,,,7140000.0,1130190.0,233377315.0,2997776.0,3073471.0,162151.0,2.0,48800000.0,135.6,66.3,101.3,461858.0,558941.0,,2165378135.02,117.7,1442357709.77,39060000.0,4650000.0,34410000.0,98810255420.0,50154639390.0,48655616030.0
879,04/01/2020 12:00:00 AM,2020-04-01,2020,3010000.0,130000.0,2880000.0,4666471.0,93535952.0,42458161.0,1095423.0,980535.0,,,,,,23078000.0,121154.0,36018048.0,2070618.0,2745367.0,121903.0,2.0,48900000.0,125.3,9.9,67.2,316002.0,402091.0,,2025803327.12,106.8,1447281134.2499998,3010000.0,130000.0,2880000.0,58122974268.0,28356685451.0,29766288817.0
880,05/01/2020 12:00:00 AM,2020-05-01,2020,8420000.0,190000.0,8240000.0,5662109.0,106185406.0,50584430.0,912922.0,740171.0,,,,,,20985000.0,213983.0,69098462.0,2037397.0,2745323.0,128937.0,2.0,48400000.0,127.1,11.5,69.0,347669.0,417586.0,,2228769680.32,110.0,1583861039.78,,,,56068942704.0,25367164296.0,30701778408.0
881,06/01/2020 12:00:00 AM,2020-06-01,2020,,,,7066933.0,159082555.0,73729935.0,1004933.0,794256.0,,,,,,17750000.0,,,,,,,41500000.0,128.3,,,,,,,111.4,,,,,82051488527.99998,41591152333.0,40460336195.0
882,07/01/2020 12:00:00 AM,2020-07-01,2020,,,,,,,1295960.0,1042017.0,,,,,,16338000.0,,,,,,,,,,,,,,,,,,,,,,
